name,temperature,symbol,weatherDescription,text,windSpeed,windGust,cardinalWindDirection,windDirection,humidity,rainfall,pressure,dayName,date,reportTime,source_file,datetime
Athenry,10,15n,Fog / Mist,"""Mist""",4,-,W,270, 97 , 0.0 ,1023,Tuesday,29-10-2024,00:00,weather.json,2024-10-29 00:00:00
Athenry,9,15n,Fog / Mist,"""Fog thickening""",4,-,SW,225, 97 , 0.0 ,1024,Tuesday,29-10-2024,01:00,weather.json,2024-10-29 01:00:00
Athenry,9,15n,Fog / Mist,"""Fog thickening""",2,-,W,270, 99 , 0.0 ,1024,Tuesday,29-10-2024,02:00,weather.json,2024-10-29 02:00:00
Athenry,9,15n,Fog / Mist,"""Fog thinning""",4,-,SW,225, 99 , 0.0 ,1024,Tuesday,29-10-2024,03:00,weather.json,2024-10-29 03:00:00
Athenry,9,15n,Fog / Mist,"""Fog thickening""",6,-,SW,225, 99 , 0.1 ,1024,Tuesday,29-10-2024,04:00,weather.json,2024-10-29 04:00:00
Athenry,8,15n,Fog / Mist,"""Fog thinning""",-,-,,0, 98 , 0.0 ,1025,Tuesday,29-10-2024,05:00,weather.json,2024-10-29 05:00:00
Athenry,6,15n,Fog / Mist,"""Fog thickening""",-,-,,0, 98 , 0.0 ,1025,Tuesday,29-10-2024,06:00,weather.json,2024-10-29 06:00:00
Athenry,7,15n,Fog / Mist,"""Fog""",2,-,SW,225, 99 , 0.0 ,1025,Tuesday,29-10-2024,07:00,weather.json,2024-10-29 07:00:00
Athenry,7,15d,Fog / Mist,"""Fog thinning""",-,-,,0, 97 , 0.1 ,1026,Tuesday,29-10-2024,08:00,weather.json,2024-10-29 08:00:00
Athenry,9,15d,Fog / Mist,"""Fog""",2,-,S,180, 98 , 0.0 ,1026,Tuesday,29-10-2024,09:00,weather.json,2024-10-29 09:00:00
Athenry,10,15d,Fog / Mist,"""Recent Fog""",4,-,SW,225, 98 , 0.0 ,1026,Tuesday,29-10-2024,10:00,weather.json,2024-10-29 10:00:00
Athenry,11,15d,Fog / Mist,"""Fog patches""",6,-,SW,225, 97 , 0.0 ,1027,Tuesday,29-10-2024,11:00,weather.json,2024-10-29 11:00:00
Athenry,12,04d,Cloudy,"""Cloudy""",6,-,W,270, 97 , 0.0 ,1027,Tuesday,29-10-2024,12:00,weather.json,2024-10-29 12:00:00
Athenry,13,04d,Cloudy,"""Cloudy""",9,-,SW,225, 92 , 0.0 ,1027,Tuesday,29-10-2024,13:00,weather.json,2024-10-29 13:00:00
Athenry,13,04d,Cloudy,"""Cloudy""",7,-,W,270, 88 , 0.0 ,1027,Tuesday,29-10-2024,14:00,weather.json,2024-10-29 14:00:00
Athenry,14,02d,Fair,"""Fair""",7,-,W,270, 81 , 0.0 ,1026,Tuesday,29-10-2024,15:00,weather.json,2024-10-29 15:00:00
Athenry,14,02d,Fair,"""Fair""",7,-,W,270, 88 , 0.0 ,1027,Tuesday,29-10-2024,16:00,weather.json,2024-10-29 16:00:00
Athenry,12,04d,Cloudy,"""Cloudy""",6,-,SW,225, 93 , 0.0 ,1027,Tuesday,29-10-2024,17:00,weather.json,2024-10-29 17:00:00
Athenry,12,04n,Cloudy,"""Cloudy""",2,-,SW,225, 94 , 0.0 ,1028,Tuesday,29-10-2024,18:00,weather.json,2024-10-29 18:00:00
Athenry,11,04n,Cloudy,"""Cloudy""",-,-,,0, 95 , 0.0 ,1028,Tuesday,29-10-2024,19:00,weather.json,2024-10-29 19:00:00
Athenry,11,15n,Fog / Mist,"""Mist""",7,-,E,90, 96 , 0.0 ,1028,Sunday,03-11-2024,00:00,20241103_191637.json,2024-11-03 00:00:00
Athenry,11,04n,Cloudy,"""Cloudy""",6,-,E,90, 94 , 0.0 ,1028,Sunday,03-11-2024,01:00,20241103_191637.json,2024-11-03 01:00:00
Athenry,11,04n,Cloudy,"""Cloudy""",7,-,SE,135, 89 , 0.0 ,1028,Sunday,03-11-2024,02:00,20241103_191637.json,2024-11-03 02:00:00
Athenry,11,15n,Fog / Mist,"""Mist""",6,-,SE,135, 94 , 0.1 ,1027,Sunday,03-11-2024,03:00,20241103_191637.json,2024-11-03 03:00:00
Athenry,10,15n,Fog / Mist,"""Mist""",4,-,E,90, 95 , 0.0 ,1027,Sunday,03-11-2024,04:00,20241103_191637.json,2024-11-03 04:00:00
Athenry,10,15n,Fog / Mist,"""Mist""",4,-,SE,135, 95 , 0.0 ,1027,Sunday,03-11-2024,05:00,20241103_191637.json,2024-11-03 05:00:00
Athenry,10,15n,Fog / Mist,"""Mist""",6,-,SE,135, 95 , 0.0 ,1027,Sunday,03-11-2024,06:00,20241103_191637.json,2024-11-03 06:00:00
Athenry,10,15n,Fog / Mist,"""Mist""",6,-,E,90, 95 , 0.1 ,1026,Sunday,03-11-2024,07:00,20241103_191637.json,2024-11-03 07:00:00
Athenry,10,15d,Fog / Mist,"""Mist""",2,-,SE,135, 96 , 0.0 ,1027,Sunday,03-11-2024,08:00,20241103_191637.json,2024-11-03 08:00:00
Athenry,10,15d,Fog / Mist,"""Mist""",7,-,E,90, 96 , 0.0 ,1027,Sunday,03-11-2024,09:00,20241103_191637.json,2024-11-03 09:00:00
Athenry,11,15d,Fog / Mist,"""Mist""",7,-,E,90, 95 , 0.0 ,1027,Sunday,03-11-2024,10:00,20241103_191637.json,2024-11-03 10:00:00
Athenry,11,15d,Fog / Mist,"""Mist""",9,-,E,90, 94 , 0.0 ,1027,Sunday,03-11-2024,11:00,20241103_191637.json,2024-11-03 11:00:00
Athenry,12,15d,Fog / Mist,"""Mist""",6,-,E,90, 93 , 0.0 ,1026,Sunday,03-11-2024,12:00,20241103_191637.json,2024-11-03 12:00:00
Athenry,13,04d,Cloudy,"""Cloudy""",11,-,E,90, 88 , 0.0 ,1026,Sunday,03-11-2024,13:00,20241103_191637.json,2024-11-03 13:00:00
Athenry,13,04d,Cloudy,"""Cloudy""",6,-,E,90, 88 , 0.0 ,1025,Sunday,03-11-2024,14:00,20241103_191637.json,2024-11-03 14:00:00
Athenry,13,04d,Cloudy,"""Cloudy""",7,-,E,90, 88 , 0.0 ,1025,Sunday,03-11-2024,15:00,20241103_191637.json,2024-11-03 15:00:00
Athenry,13,04d,Cloudy,"""Cloudy""",6,-,E,90, 89 , 0.0 ,1025,Sunday,03-11-2024,16:00,20241103_191637.json,2024-11-03 16:00:00
Athenry,12,04n,Cloudy,"""Cloudy""",6,-,E,90, 90 , 0.0 ,1025,Sunday,03-11-2024,17:00,20241103_191637.json,2024-11-03 17:00:00
Athenry,12,04n,Cloudy,"""Cloudy""",7,-,E,90, 92 , 0.0 ,1025,Sunday,03-11-2024,18:00,20241103_191637.json,2024-11-03 18:00:00
Athenry,12,04n,Cloudy,"""Cloudy""",7,-,E,90, 92 , 0.0 ,1025,Sunday,03-11-2024,19:00,20241103_191637.json,2024-11-03 19:00:00
Athenry,11,46n,Light rain ,"""Recent Drizzle """,9,-,W,270, 99 , 0.2 ,1022,Saturday,16-11-2024,00:00,20241116_171031.json,2024-11-16 00:00:00
Athenry,11,04n,Cloudy,"""Cloudy""",9,-,W,270, 98 , 0.0 ,1021,Saturday,16-11-2024,01:00,20241116_171031.json,2024-11-16 01:00:00
Athenry,11,04n,Cloudy,"""Cloudy""",7,-,W,270, 97 , 0.0 ,1021,Saturday,16-11-2024,02:00,20241116_171031.json,2024-11-16 02:00:00
Athenry,11,04n,Cloudy,"""Cloudy""",9,-,W,270, 99 , 0.0 ,1020,Saturday,16-11-2024,03:00,20241116_171031.json,2024-11-16 03:00:00
Athenry,11,04n,Cloudy,"""Cloudy""",7,-,W,270, 99 , 0.0 ,1020,Saturday,16-11-2024,04:00,20241116_171031.json,2024-11-16 04:00:00
Athenry,11,46n,Light rain ,"""Recent Drizzle """,9,-,W,270, 99 , 0.1 ,1020,Saturday,16-11-2024,05:00,20241116_171031.json,2024-11-16 05:00:00
Athenry,9,40n,Light rain showers,"""Recent Rain""",13,-,N,0, 98 , 0.5 ,1020,Saturday,16-11-2024,06:00,20241116_171031.json,2024-11-16 06:00:00
Athenry,9,05n,Rain showers,"""Rain shower""",17,-,N,0, 97 , 0.2 ,1021,Saturday,16-11-2024,07:00,20241116_171031.json,2024-11-16 07:00:00
Athenry,8,46d,Light rain ,"""Recent Drizzle """,7,-,N,0, 96 , 0.01 ,1021,Saturday,16-11-2024,08:00,20241116_171031.json,2024-11-16 08:00:00
Athenry,8,04d,Cloudy,"""Cloudy""",6,-,NW,315, 96 , 0.0 ,1021,Saturday,16-11-2024,09:00,20241116_171031.json,2024-11-16 09:00:00
Athenry,9,04d,Cloudy,"""Cloudy""",7,-,NW,315, 93 , 0.0 ,1022,Saturday,16-11-2024,10:00,20241116_171031.json,2024-11-16 10:00:00
Athenry,10,04d,Cloudy,"""Cloudy""",9,-,W,270, 77 , 0.0 ,1022,Saturday,16-11-2024,11:00,20241116_171031.json,2024-11-16 11:00:00
Athenry,10,04d,Cloudy,"""Cloudy""",6,-,W,270, 77 , 0.0 ,1022,Saturday,16-11-2024,12:00,20241116_171031.json,2024-11-16 12:00:00
Athenry,10,04d,Cloudy,"""Cloudy""",9,-,W,270, 76 , 0.0 ,1021,Saturday,16-11-2024,13:00,20241116_171031.json,2024-11-16 13:00:00
Athenry,10,46d,Light rain ,"""Recent Drizzle """,9,-,W,270, 78 , 0.01 ,1021,Saturday,16-11-2024,14:00,20241116_171031.json,2024-11-16 14:00:00
Athenry,8,46d,Light rain ,"""Recent Drizzle """,7,-,W,270, 85 , 0.01 ,1021,Saturday,16-11-2024,15:00,20241116_171031.json,2024-11-16 15:00:00
Athenry,8,04d,Cloudy,"""Cloudy""",6,-,W,270, 90 , 0.0 ,1021,Saturday,16-11-2024,16:00,20241116_171031.json,2024-11-16 16:00:00
Athenry,6,04n,Cloudy,"""Cloudy""",9,-,W,270, 89 , 0.0 ,1021,Sunday,17-11-2024,00:00,20241117_152204.json,2024-11-17 00:00:00
Athenry,7,04n,Cloudy,"""Cloudy""",4,-,W,270, 90 , 0.0 ,1020,Sunday,17-11-2024,01:00,20241117_152204.json,2024-11-17 01:00:00
Athenry,7,04n,Cloudy,"""Cloudy""",7,-,W,270, 89 , 0.0 ,1020,Sunday,17-11-2024,02:00,20241117_152204.json,2024-11-17 02:00:00
Athenry,7,04n,Cloudy,"""Cloudy""",6,-,W,270, 90 , 0.0 ,1020,Sunday,17-11-2024,03:00,20241117_152204.json,2024-11-17 03:00:00
Athenry,8,04n,Cloudy,"""Cloudy""",6,-,W,270, 90 , 0.0 ,1019,Sunday,17-11-2024,04:00,20241117_152204.json,2024-11-17 04:00:00
Athenry,8,04n,Cloudy,"""Cloudy""",7,-,W,270, 90 , 0.0 ,1019,Sunday,17-11-2024,05:00,20241117_152204.json,2024-11-17 05:00:00
Athenry,8,04n,Cloudy,"""Cloudy""",7,-,W,270, 90 , 0.0 ,1018,Sunday,17-11-2024,06:00,20241117_152204.json,2024-11-17 06:00:00
Athenry,8,04n,Cloudy,"""Cloudy""",7,-,W,270, 92 , 0.0 ,1018,Sunday,17-11-2024,07:00,20241117_152204.json,2024-11-17 07:00:00
Athenry,9,04d,Cloudy,"""Cloudy""",7,-,SW,225, 93 , 0.0 ,1018,Sunday,17-11-2024,08:00,20241117_152204.json,2024-11-17 08:00:00
Athenry,9,04d,Cloudy,"""Cloudy""",7,-,W,270, 92 , 0.0 ,1017,Sunday,17-11-2024,09:00,20241117_152204.json,2024-11-17 09:00:00
Athenry,10,04d,Cloudy,"""Cloudy""",11,-,W,270, 86 , 0.0 ,1017,Sunday,17-11-2024,10:00,20241117_152204.json,2024-11-17 10:00:00
Athenry,10,46d,Light rain ,"""Recent Drizzle """,9,-,W,270, 87 , 0.01 ,1017,Sunday,17-11-2024,11:00,20241117_152204.json,2024-11-17 11:00:00
Athenry,11,04d,Cloudy,"""Cloudy""",11,-,W,270, 85 , 0.0 ,1016,Sunday,17-11-2024,12:00,20241117_152204.json,2024-11-17 12:00:00
Athenry,11,04d,Cloudy,"""Cloudy""",13,-,W,270, 85 , 0.0 ,1016,Sunday,17-11-2024,13:00,20241117_152204.json,2024-11-17 13:00:00
Athenry,11,46d,Light rain ,"""Recent Drizzle """,13,-,W,270, 92 , 0.2 ,1015,Sunday,17-11-2024,14:00,20241117_152204.json,2024-11-17 14:00:00
Athenry,11,04d,Cloudy,"""Cloudy""",11,-,W,270, 86 , 0.0 ,1015,Sunday,17-11-2024,15:00,20241117_152204.json,2024-11-17 15:00:00
Athenry,7,02n,Fair,"""Fair""",17,-,NW,315, 88 , 0.0 ,1013,Monday,02-12-2024,00:00,20241202_101029.json,2024-12-02 00:00:00
Athenry,7,04n,Cloudy,"""Cloudy""",15,-,W,270, 85 , 0.0 ,1014,Monday,02-12-2024,01:00,20241202_101029.json,2024-12-02 01:00:00
Athenry,7,02n,Fair,"""Fair""",17,-,NW,315, 86 , 0.0 ,1015,Monday,02-12-2024,02:00,20241202_101029.json,2024-12-02 02:00:00
Athenry,6,46n,Light rain ,"""Moderate Drizzle """,26,-,NW,315, 86 , 0.01 ,1016,Monday,02-12-2024,03:00,20241202_101029.json,2024-12-02 03:00:00
Athenry,5,46n,Light rain ,"""Recent Drizzle """,15,-,NW,315, 89 , 0.01 ,1017,Monday,02-12-2024,04:00,20241202_101029.json,2024-12-02 04:00:00
Athenry,5,02n,Fair,"""Fair""",11,-,NW,315, 89 , 0.0 ,1017,Monday,02-12-2024,05:00,20241202_101029.json,2024-12-02 05:00:00
Athenry,4,02n,Fair,"""Fair""",13,-,W,270, 87 , 0.0 ,1018,Monday,02-12-2024,06:00,20241202_101029.json,2024-12-02 06:00:00
Athenry,5,02n,Fair,"""Fair""",20,-,NW,315, 84 , 0.0 ,1018,Monday,02-12-2024,07:00,20241202_101029.json,2024-12-02 07:00:00
Athenry,4,02n,Fair,"""Fair""",15,-,NW,315, 86 , 0.0 ,1020,Monday,02-12-2024,08:00,20241202_101029.json,2024-12-02 08:00:00
Athenry,4,02d,Fair,"""Fair""",11,-,NW,315, 87 , 0.0 ,1021,Monday,02-12-2024,09:00,20241202_101029.json,2024-12-02 09:00:00
Athenry,0,02n,Fair,"""Fair""",9,-,E,90, 95 , 0.0 ,1022,Tuesday,03-12-2024,00:00,20241203_101008.json,2024-12-03 00:00:00
Athenry,0,02n,Fair,"""Fair""",9,-,E,90, 94 , 0.0 ,1021,Tuesday,03-12-2024,01:00,20241203_101008.json,2024-12-03 01:00:00
Athenry,0,02n,Fair,"""Fair""",9,-,E,90, 93 , 0.0 ,1021,Tuesday,03-12-2024,02:00,20241203_101008.json,2024-12-03 02:00:00
Athenry,0,04n,Cloudy,"""Cloudy""",9,-,E,90, 94 , 0.0 ,1021,Tuesday,03-12-2024,03:00,20241203_101008.json,2024-12-03 03:00:00
Athenry,1,02n,Fair,"""Fair""",9,-,E,90, 94 , 0.0 ,1020,Tuesday,03-12-2024,04:00,20241203_101008.json,2024-12-03 04:00:00
Athenry,1,02n,Fair,"""Fair""",9,-,E,90, 94 , 0.0 ,1020,Tuesday,03-12-2024,05:00,20241203_101008.json,2024-12-03 05:00:00
Athenry,1,04n,Cloudy,"""Cloudy""",13,-,E,90, 93 , 0.0 ,1020,Tuesday,03-12-2024,06:00,20241203_101008.json,2024-12-03 06:00:00
Athenry,1,04n,Cloudy,"""Cloudy""",11,-,E,90, 94 , 0.0 ,1020,Tuesday,03-12-2024,07:00,20241203_101008.json,2024-12-03 07:00:00
Athenry,1,02n,Fair,"""Fair""",13,-,E,90, 94 , 0.0 ,1019,Tuesday,03-12-2024,08:00,20241203_101008.json,2024-12-03 08:00:00
Athenry,1,02d,Fair,"""Fair""",9,-,E,90, 93 , 0.0 ,1020,Tuesday,03-12-2024,09:00,20241203_101008.json,2024-12-03 09:00:00
Athenry,2,15n,Fog / Mist,"""Fog thinning""",2,-,S,180, 98 , 0.0 ,1024,Wednesday,04-12-2024,00:00,20241204_100941.json,2024-12-04 00:00:00
Athenry,2,15n,Fog / Mist,"""Fog thickening""",-,-,,0, 99 , 0.0 ,1024,Wednesday,04-12-2024,01:00,20241204_100941.json,2024-12-04 01:00:00
Athenry,2,15n,Fog / Mist,"""Fog""",4,-,E,90, 99 , 0.0 ,1023,Wednesday,04-12-2024,02:00,20241204_100941.json,2024-12-04 02:00:00
Athenry,1,15n,Fog / Mist,"""Fog thinning""",6,-,E,90, 99 , 0.0 ,1023,Wednesday,04-12-2024,03:00,20241204_100941.json,2024-12-04 03:00:00
Athenry,1,15n,Fog / Mist,"""Recent Fog""",4,-,E,90, 99 , 0.0 ,1022,Wednesday,04-12-2024,04:00,20241204_100941.json,2024-12-04 04:00:00
Athenry,1,15n,Fog / Mist,"""Mist""",-,-,,0, 99 , 0.0 ,1022,Wednesday,04-12-2024,05:00,20241204_100941.json,2024-12-04 05:00:00
Athenry,2,15n,Fog / Mist,"""Fog thickening""",4,-,SE,135, 99 , 0.0 ,1021,Wednesday,04-12-2024,06:00,20241204_100941.json,2024-12-04 06:00:00
Athenry,3,15n,Fog / Mist,"""Fog""",7,-,E,90, 99 , 0.0 ,1020,Wednesday,04-12-2024,07:00,20241204_100941.json,2024-12-04 07:00:00
Athenry,5,15n,Fog / Mist,"""Recent Fog""",7,-,E,90, 96 , 0.0 ,1019,Wednesday,04-12-2024,08:00,20241204_100941.json,2024-12-04 08:00:00
Athenry,7,04d,Cloudy,"""Cloudy""",17,-,SE,135, 91 , 0.0 ,1018,Wednesday,04-12-2024,09:00,20241204_100941.json,2024-12-04 09:00:00
Athenry,11,15n,Fog / Mist,"""Mist""",7,-,SW,225, 89 , 0.0 ,1006,Thursday,05-12-2024,00:00,20241205_100955.json,2024-12-05 00:00:00
Athenry,11,46n,Light rain ,"""Light rain """,15,-,W,270, 86 , 0.01 ,1007,Thursday,05-12-2024,01:00,20241205_100955.json,2024-12-05 01:00:00
Athenry,10,40n,Light rain showers,"""Recent Rain""",9,-,W,270, 95 , 0.1 ,1006,Thursday,05-12-2024,02:00,20241205_100955.json,2024-12-05 02:00:00
Athenry,10,04n,Cloudy,"""Cloudy""",11,-,W,270, 94 , 0.0 ,1007,Thursday,05-12-2024,03:00,20241205_100955.json,2024-12-05 03:00:00
Athenry,9,02n,Fair,"""Fair""",13,-,W,270, 94 , 0.0 ,1007,Thursday,05-12-2024,04:00,20241205_100955.json,2024-12-05 04:00:00
Athenry,9,02n,Fair,"""Fair""",9,-,S,180, 92 , 0.1 ,1006,Thursday,05-12-2024,05:00,20241205_100955.json,2024-12-05 05:00:00
Athenry,10,04n,Cloudy,"""Cloudy""",11,-,SW,225, 87 , 0.0 ,1006,Thursday,05-12-2024,06:00,20241205_100955.json,2024-12-05 06:00:00
Athenry,10,04n,Cloudy,"""Cloudy""",11,-,SW,225, 89 , 0.0 ,1005,Thursday,05-12-2024,07:00,20241205_100955.json,2024-12-05 07:00:00
Athenry,10,05n,Rain showers,"""Rain shower""",11,-,SW,225, 94 , 0.01 ,1004,Thursday,05-12-2024,08:00,20241205_100955.json,2024-12-05 08:00:00
Athenry,10,46d,Light rain ,"""Recent Drizzle """,11,-,SW,225, 93 , 0.2 ,1003,Thursday,05-12-2024,09:00,20241205_100955.json,2024-12-05 09:00:00
Athenry,3,02n,Fair,"""Fair""",6,-,W,270, 92 , 0.0 ,1015,Friday,06-12-2024,00:00,20241206_100941.json,2024-12-06 00:00:00
Athenry,3,02n,Fair,"""Fair""",7,-,W,270, 94 , 0.0 ,1016,Friday,06-12-2024,01:00,20241206_100941.json,2024-12-06 01:00:00
Athenry,2,02n,Fair,"""Fair""",4,-,SW,225, 92 , 0.0 ,1017,Friday,06-12-2024,02:00,20241206_100941.json,2024-12-06 02:00:00
Athenry,3,02n,Fair,"""Fair""",6,-,W,270, 94 , 0.0 ,1017,Friday,06-12-2024,03:00,20241206_100941.json,2024-12-06 03:00:00
Athenry,3,02n,Fair,"""Fair""",7,-,S,180, 95 , 0.0 ,1017,Friday,06-12-2024,04:00,20241206_100941.json,2024-12-06 04:00:00
Athenry,3,02n,Fair,"""Fair""",4,-,S,180, 96 , 0.0 ,1017,Friday,06-12-2024,05:00,20241206_100941.json,2024-12-06 05:00:00
Athenry,3,04n,Cloudy,"""Cloudy""",4,-,S,180, 94 , 0.0 ,1016,Friday,06-12-2024,06:00,20241206_100941.json,2024-12-06 06:00:00
Athenry,5,04n,Cloudy,"""Cloudy""",4,-,S,180, 89 , 0.0 ,1015,Friday,06-12-2024,07:00,20241206_100941.json,2024-12-06 07:00:00
Athenry,6,04n,Cloudy,"""Cloudy""",6,-,S,180, 88 , 0.0 ,1014,Friday,06-12-2024,08:00,20241206_100941.json,2024-12-06 08:00:00
Athenry,6,46d,Light rain ,"""Light rain """,9,-,S,180, 91 , 0.3 ,1014,Friday,06-12-2024,09:00,20241206_100941.json,2024-12-06 09:00:00
Athenry,7,,N/A,,57,93,NW,315,-99, 1.3 ,993,Saturday,07-12-2024,00:00,20241207_100825.json,2024-12-07 00:00:00
Athenry,6,,N/A,,46,102,NW,315,-99, 1.7 ,997,Saturday,07-12-2024,01:00,20241207_100825.json,2024-12-07 01:00:00
Athenry,6,,N/A,,54,85,NW,315,-99, 0.8 ,999,Saturday,07-12-2024,02:00,20241207_100825.json,2024-12-07 02:00:00
Athenry,7,,N/A,,52,96,NW,315,-99, 0.1 ,1002,Saturday,07-12-2024,03:00,20241207_100825.json,2024-12-07 03:00:00
Athenry,7,,N/A,,52,89,NW,315,-99, 0.0 ,1003,Saturday,07-12-2024,04:00,20241207_100825.json,2024-12-07 04:00:00
Athenry,7,,N/A,,46,80,NW,315,-99, 0.0 ,1005,Saturday,07-12-2024,05:00,20241207_100825.json,2024-12-07 05:00:00
Athenry,6,,N/A,,43,81,NW,315,-99, 0.0 ,1007,Saturday,07-12-2024,06:00,20241207_100825.json,2024-12-07 06:00:00
Athenry,6,,N/A,,41,89,NW,315,-99, 0.0 ,1009,Saturday,07-12-2024,07:00,20241207_100825.json,2024-12-07 07:00:00
Athenry,6,,N/A,,50,78,NW,315,-99, 0.0 ,1011,Saturday,07-12-2024,08:00,20241207_100825.json,2024-12-07 08:00:00
Athenry,6,,N/A,,44,72,NW,315,-99, 0.0 ,1013,Saturday,07-12-2024,09:00,20241207_100825.json,2024-12-07 09:00:00
Athenry,4,02n,Fair,"""Fair""",17,-,NW,315, 85 , 0.0 ,1032,Sunday,08-12-2024,00:00,20241208_100812.json,2024-12-08 00:00:00
Athenry,4,02n,Fair,"""Fair""",15,-,NW,315, 87 , 0.0 ,1033,Sunday,08-12-2024,01:00,20241208_100812.json,2024-12-08 01:00:00
Athenry,4,40n,Light rain showers,"""Recent Rain""",15,-,NW,315, 89 , 0.01 ,1034,Sunday,08-12-2024,02:00,20241208_100812.json,2024-12-08 02:00:00
Athenry,3,05n,Rain showers,"""Rain shower""",11,-,NW,315, 91 , 0.1 ,1035,Sunday,08-12-2024,03:00,20241208_100812.json,2024-12-08 03:00:00
Athenry,3,40n,Light rain showers,"""Recent Precipitation""",2,-,N,0, 91 , 0.01 ,1036,Sunday,08-12-2024,04:00,20241208_100812.json,2024-12-08 04:00:00
Athenry,2,02n,Fair,"""Fair""",11,-,NW,315, 93 , 0.0 ,1036,Sunday,08-12-2024,05:00,20241208_100812.json,2024-12-08 05:00:00
Athenry,3,02n,Fair,"""Fair""",15,-,NW,315, 92 , 0.0 ,1037,Sunday,08-12-2024,06:00,20241208_100812.json,2024-12-08 06:00:00
Athenry,4,04n,Cloudy,"""Cloudy""",13,-,NW,315, 92 , 0.0 ,1037,Sunday,08-12-2024,07:00,20241208_100812.json,2024-12-08 07:00:00
Athenry,4,46n,Light rain ,"""Recent Drizzle """,11,-,N,0, 91 , 0.01 ,1038,Sunday,08-12-2024,08:00,20241208_100812.json,2024-12-08 08:00:00
Athenry,4,02d,Fair,"""Fair""",7,-,N,0, 89 , 0.0 ,1038,Sunday,08-12-2024,09:00,20241208_100812.json,2024-12-08 09:00:00
Athenry,0,02n,Fair,"""Fair""",6,-,NW,315, 94 , 0.0 ,1042,Monday,09-12-2024,00:00,20241209_101032.json,2024-12-09 00:00:00
Athenry,-1,02n,Fair,"""Fair""",9,-,N,0, 96 , 0.0 ,1042,Monday,09-12-2024,01:00,20241209_101032.json,2024-12-09 01:00:00
Athenry,0,02n,Fair,"""Fair""",7,-,N,0, 94 , 0.0 ,1042,Monday,09-12-2024,02:00,20241209_101032.json,2024-12-09 02:00:00
Athenry,0,02n,Fair,"""Fair""",9,-,N,0, 96 , 0.0 ,1042,Monday,09-12-2024,03:00,20241209_101032.json,2024-12-09 03:00:00
Athenry,-1,02n,Fair,"""Fair""",9,-,N,0, 96 , 0.0 ,1042,Monday,09-12-2024,04:00,20241209_101032.json,2024-12-09 04:00:00
Athenry,1,02n,Fair,"""Fair""",11,-,N,0, 94 , 0.0 ,1042,Monday,09-12-2024,05:00,20241209_101032.json,2024-12-09 05:00:00
Athenry,1,02n,Fair,"""Fair""",7,-,S,180, 93 , 0.0 ,1042,Monday,09-12-2024,06:00,20241209_101032.json,2024-12-09 06:00:00
Athenry,0,02n,Fair,"""Fair""",4,-,W,270, 95 , 0.0 ,1042,Monday,09-12-2024,07:00,20241209_101032.json,2024-12-09 07:00:00
Athenry,-1,02n,Fair,"""Fair""",7,-,N,0, 96 , 0.0 ,1043,Monday,09-12-2024,08:00,20241209_101032.json,2024-12-09 08:00:00
Athenry,-1,02d,Fair,"""Fair""",4,-,N,0, 96 , 0.0 ,1043,Monday,09-12-2024,09:00,20241209_101032.json,2024-12-09 09:00:00
Athenry,3,04n,Cloudy,"""Cloudy""",6,-,N,0, 86 , 0.0 ,1038,Wednesday,11-12-2024,00:00,20241211_100939.json,2024-12-11 00:00:00
Athenry,3,04n,Cloudy,"""Cloudy""",7,-,N,0, 85 , 0.0 ,1037,Wednesday,11-12-2024,01:00,20241211_100939.json,2024-12-11 01:00:00
Athenry,3,04n,Cloudy,"""Cloudy""",6,-,NE,45, 86 , 0.0 ,1037,Wednesday,11-12-2024,02:00,20241211_100939.json,2024-12-11 02:00:00
Athenry,3,04n,Cloudy,"""Cloudy""",6,-,NE,45, 87 , 0.0 ,1037,Wednesday,11-12-2024,03:00,20241211_100939.json,2024-12-11 03:00:00
Athenry,2,04n,Cloudy,"""Cloudy""",6,-,NE,45, 89 , 0.0 ,1036,Wednesday,11-12-2024,04:00,20241211_100939.json,2024-12-11 04:00:00
Athenry,3,04n,Cloudy,"""Cloudy""",2,-,NE,45, 88 , 0.0 ,1036,Wednesday,11-12-2024,05:00,20241211_100939.json,2024-12-11 05:00:00
Athenry,3,04n,Cloudy,"""Cloudy""",7,-,NE,45, 87 , 0.0 ,1036,Wednesday,11-12-2024,06:00,20241211_100939.json,2024-12-11 06:00:00
Athenry,3,04n,Cloudy,"""Cloudy""",6,-,NE,45, 86 , 0.0 ,1036,Wednesday,11-12-2024,07:00,20241211_100939.json,2024-12-11 07:00:00
Athenry,3,04n,Cloudy,"""Cloudy""",9,-,NE,45, 84 , 0.0 ,1037,Wednesday,11-12-2024,08:00,20241211_100939.json,2024-12-11 08:00:00
Athenry,3,04d,Cloudy,"""Cloudy""",6,-,E,90, 83 , 0.0 ,1037,Wednesday,11-12-2024,09:00,20241211_100939.json,2024-12-11 09:00:00
Athenry,4,04n,Cloudy,"""Cloudy""",7,-,E,90, 78 , 0.0 ,1035,Thursday,12-12-2024,00:00,20241212_100944.json,2024-12-12 00:00:00
Athenry,4,04n,Cloudy,"""Cloudy""",6,-,SE,135, 79 , 0.0 ,1034,Thursday,12-12-2024,01:00,20241212_100944.json,2024-12-12 01:00:00
Athenry,4,04n,Cloudy,"""Cloudy""",6,-,SE,135, 79 , 0.0 ,1034,Thursday,12-12-2024,02:00,20241212_100944.json,2024-12-12 02:00:00
Athenry,4,04n,Cloudy,"""Cloudy""",7,-,SE,135, 75 , 0.0 ,1034,Thursday,12-12-2024,03:00,20241212_100944.json,2024-12-12 03:00:00
Athenry,4,04n,Cloudy,"""Cloudy""",4,-,SE,135, 80 , 0.0 ,1034,Thursday,12-12-2024,04:00,20241212_100944.json,2024-12-12 04:00:00
Athenry,4,04n,Cloudy,"""Cloudy""",4,-,SE,135, 78 , 0.0 ,1034,Thursday,12-12-2024,05:00,20241212_100944.json,2024-12-12 05:00:00
Athenry,3,04n,Cloudy,"""Cloudy""",4,-,SE,135, 78 , 0.0 ,1033,Thursday,12-12-2024,06:00,20241212_100944.json,2024-12-12 06:00:00
Athenry,3,04n,Cloudy,"""Cloudy""",7,-,E,90, 80 , 0.0 ,1033,Thursday,12-12-2024,07:00,20241212_100944.json,2024-12-12 07:00:00
Athenry,3,04n,Cloudy,"""Cloudy""",6,-,E,90, 81 , 0.0 ,1033,Thursday,12-12-2024,08:00,20241212_100944.json,2024-12-12 08:00:00
Athenry,3,04d,Cloudy,"""Cloudy""",4,-,E,90, 82 , 0.0 ,1034,Thursday,12-12-2024,09:00,20241212_100944.json,2024-12-12 09:00:00
Athenry,3,15n,Fog / Mist,"""Mist""",9,-,E,90, 92 , 0.0 ,1030,Friday,13-12-2024,00:00,20241213_100945.json,2024-12-13 00:00:00
Athenry,3,15n,Fog / Mist,"""Mist""",6,-,E,90, 92 , 0.0 ,1029,Friday,13-12-2024,01:00,20241213_100945.json,2024-12-13 01:00:00
Athenry,4,15n,Fog / Mist,"""Mist""",6,-,E,90, 91 , 0.0 ,1029,Friday,13-12-2024,02:00,20241213_100945.json,2024-12-13 02:00:00
Athenry,4,15n,Fog / Mist,"""Mist""",7,-,E,90, 89 , 0.0 ,1029,Friday,13-12-2024,03:00,20241213_100945.json,2024-12-13 03:00:00
Athenry,4,04n,Cloudy,"""Cloudy""",4,-,E,90, 91 , 0.0 ,1029,Friday,13-12-2024,04:00,20241213_100945.json,2024-12-13 04:00:00
Athenry,4,04n,Cloudy,"""Cloudy""",7,-,E,90, 90 , 0.0 ,1028,Friday,13-12-2024,05:00,20241213_100945.json,2024-12-13 05:00:00
Athenry,4,04n,Cloudy,"""Cloudy""",4,-,E,90, 90 , 0.0 ,1028,Friday,13-12-2024,06:00,20241213_100945.json,2024-12-13 06:00:00
Athenry,4,04n,Cloudy,"""Cloudy""",7,-,E,90, 90 , 0.0 ,1028,Friday,13-12-2024,07:00,20241213_100945.json,2024-12-13 07:00:00
Athenry,4,04n,Cloudy,"""Cloudy""",4,-,NE,45, 91 , 0.0 ,1028,Friday,13-12-2024,08:00,20241213_100945.json,2024-12-13 08:00:00
Athenry,4,04d,Cloudy,"""Cloudy""",4,-,W,270, 92 , 0.0 ,1029,Friday,13-12-2024,09:00,20241213_100945.json,2024-12-13 09:00:00
Athenry,2,02n,Fair,"""Fair""",7,-,NW,315, 97 , 0.0 ,1027,Saturday,14-12-2024,00:00,20241214_100815.json,2024-12-14 00:00:00
Athenry,2,02n,Fair,"""Fair""",7,-,W,270, 96 , 0.0 ,1026,Saturday,14-12-2024,01:00,20241214_100815.json,2024-12-14 01:00:00
Athenry,1,02n,Fair,"""Fair""",6,-,W,270, 94 , 0.0 ,1026,Saturday,14-12-2024,02:00,20241214_100815.json,2024-12-14 02:00:00
Athenry,0,02n,Fair,"""Fair""",6,-,W,270, 96 , 0.0 ,1027,Saturday,14-12-2024,03:00,20241214_100815.json,2024-12-14 03:00:00
Athenry,3,04n,Cloudy,"""Cloudy""",7,-,W,270, 95 , 0.0 ,1027,Saturday,14-12-2024,04:00,20241214_100815.json,2024-12-14 04:00:00
Athenry,2,04n,Cloudy,"""Cloudy""",6,-,W,270, 97 , 0.0 ,1026,Saturday,14-12-2024,05:00,20241214_100815.json,2024-12-14 05:00:00
Athenry,3,04n,Cloudy,"""Cloudy""",7,-,W,270, 97 , 0.0 ,1026,Saturday,14-12-2024,06:00,20241214_100815.json,2024-12-14 06:00:00
Athenry,3,02n,Fair,"""Fair""",4,-,SW,225, 97 , 0.0 ,1026,Saturday,14-12-2024,07:00,20241214_100815.json,2024-12-14 07:00:00
Athenry,4,02n,Fair,"""Fair""",7,-,W,270, 96 , 0.0 ,1027,Saturday,14-12-2024,08:00,20241214_100815.json,2024-12-14 08:00:00
Athenry,4,04d,Cloudy,"""Cloudy""",7,-,SW,225, 96 , 0.0 ,1027,Saturday,14-12-2024,09:00,20241214_100815.json,2024-12-14 09:00:00
Athenry,11,46n,Light rain ,"""Recent Drizzle """,13,-,W,270, 98 , 0.1 ,1026,Sunday,15-12-2024,00:00,20241215_100817.json,2024-12-15 00:00:00
Athenry,11,15n,Fog / Mist,"""Mist""",15,-,W,270, 99 , 0.0 ,1026,Sunday,15-12-2024,01:00,20241215_100817.json,2024-12-15 01:00:00
Athenry,11,15n,Fog / Mist,"""Mist""",13,-,W,270, 99 , 0.0 ,1026,Sunday,15-12-2024,02:00,20241215_100817.json,2024-12-15 02:00:00
Athenry,11,15n,Fog / Mist,"""Mist""",17,-,W,270, 99 , 0.1 ,1026,Sunday,15-12-2024,03:00,20241215_100817.json,2024-12-15 03:00:00
Athenry,10,04n,Cloudy,"""Cloudy""",15,-,W,270, 99 , 0.0 ,1027,Sunday,15-12-2024,04:00,20241215_100817.json,2024-12-15 04:00:00
Athenry,10,15n,Fog / Mist,"""Mist""",15,-,SW,225, 99 , 0.0 ,1026,Sunday,15-12-2024,05:00,20241215_100817.json,2024-12-15 05:00:00
Athenry,10,15n,Fog / Mist,"""Mist""",13,-,W,270, 99 , 0.0 ,1027,Sunday,15-12-2024,06:00,20241215_100817.json,2024-12-15 06:00:00
Athenry,10,04n,Cloudy,"""Cloudy""",15,-,W,270, 98 , 0.1 ,1027,Sunday,15-12-2024,07:00,20241215_100817.json,2024-12-15 07:00:00
Athenry,10,15n,Fog / Mist,"""Mist""",13,-,W,270, 98 , 0.0 ,1027,Sunday,15-12-2024,08:00,20241215_100817.json,2024-12-15 08:00:00
Athenry,11,46d,Light rain ,"""Recent Drizzle """,19,-,W,270, 99 , 0.1 ,1028,Sunday,15-12-2024,09:00,20241215_100817.json,2024-12-15 09:00:00
Athenry,10,04n,Cloudy,"""Cloudy""",15,-,SW,225, 83 , 0.0 ,1028,Monday,16-12-2024,00:00,20241216_101025.json,2024-12-16 00:00:00
Athenry,10,04n,Cloudy,"""Cloudy""",15,-,SW,225, 81 , 0.0 ,1028,Monday,16-12-2024,01:00,20241216_101025.json,2024-12-16 01:00:00
Athenry,11,04n,Cloudy,"""Cloudy""",19,-,SW,225, 81 , 0.0 ,1028,Monday,16-12-2024,02:00,20241216_101025.json,2024-12-16 02:00:00
Athenry,11,04n,Cloudy,"""Cloudy""",20,-,W,270, 80 , 0.0 ,1027,Monday,16-12-2024,03:00,20241216_101025.json,2024-12-16 03:00:00
Athenry,10,04n,Cloudy,"""Cloudy""",15,39,SW,225, 90 , 0.0 ,1027,Monday,16-12-2024,04:00,20241216_101025.json,2024-12-16 04:00:00
Athenry,11,04n,Cloudy,"""Cloudy""",19,39,SW,225, 89 , 0.0 ,1027,Monday,16-12-2024,05:00,20241216_101025.json,2024-12-16 05:00:00
Athenry,11,04n,Cloudy,"""Cloudy""",13,-,SW,225, 88 , 0.0 ,1027,Monday,16-12-2024,06:00,20241216_101025.json,2024-12-16 06:00:00
Athenry,11,04n,Cloudy,"""Cloudy""",19,-,SW,225, 87 , 0.0 ,1027,Monday,16-12-2024,07:00,20241216_101025.json,2024-12-16 07:00:00
Athenry,11,04n,Cloudy,"""Cloudy""",22,-,SW,225, 86 , 0.0 ,1026,Monday,16-12-2024,08:00,20241216_101025.json,2024-12-16 08:00:00
Athenry,11,04d,Cloudy,"""Cloudy""",20,-,SW,225, 87 , 0.0 ,1026,Monday,16-12-2024,09:00,20241216_101025.json,2024-12-16 09:00:00
Athenry,7,04n,Cloudy,"""Cloudy""",6,-,SE,135, 94 , 0.0 ,1023,Tuesday,17-12-2024,00:00,20241217_100958.json,2024-12-17 00:00:00
Athenry,8,04n,Cloudy,"""Cloudy""",4,-,SE,135, 93 , 0.0 ,1022,Tuesday,17-12-2024,01:00,20241217_100958.json,2024-12-17 01:00:00
Athenry,10,04n,Cloudy,"""Cloudy""",13,-,S,180, 89 , 0.0 ,1021,Tuesday,17-12-2024,02:00,20241217_100958.json,2024-12-17 02:00:00
Athenry,10,04n,Cloudy,"""Cloudy""",15,-,SE,135, 87 , 0.0 ,1019,Tuesday,17-12-2024,03:00,20241217_100958.json,2024-12-17 03:00:00
Athenry,11,05n,Rain showers,"""Rain shower""",19,-,S,180, 86 , 0.01 ,1018,Tuesday,17-12-2024,04:00,20241217_100958.json,2024-12-17 04:00:00
Athenry,11,46n,Light rain ,"""Light rain """,17,41,S,180, 86 , 0.1 ,1017,Tuesday,17-12-2024,05:00,20241217_100958.json,2024-12-17 05:00:00
Athenry,11,40n,Light rain showers,"""Recent Rain""",19,-,SE,135, 84 , 0.1 ,1015,Tuesday,17-12-2024,06:00,20241217_100958.json,2024-12-17 06:00:00
Athenry,11,04n,Cloudy,"""Cloudy""",20,-,SE,135, 81 , 0.0 ,1014,Tuesday,17-12-2024,07:00,20241217_100958.json,2024-12-17 07:00:00
Athenry,11,09n,Rain,"""Moderate rain """,19,-,S,180, 88 , 0.5 ,1013,Tuesday,17-12-2024,08:00,20241217_100958.json,2024-12-17 08:00:00
Athenry,11,05d,Rain showers,"""Rain shower""",20,-,S,180, 84 , 0.1 ,1012,Tuesday,17-12-2024,09:00,20241217_100958.json,2024-12-17 09:00:00
Athenry,13,05n,Rain showers,"""Rain shower""",22,-,SW,225, 96 , 0.3 ,993,Wednesday,18-12-2024,00:00,20241218_100922.json,2024-12-18 00:00:00
Athenry,13,05n,Rain showers,"""Rain shower""",30,-,SW,225, 94 , 0.7 ,992,Wednesday,18-12-2024,01:00,20241218_100922.json,2024-12-18 01:00:00
Athenry,12,05n,Rain showers,"""Rain shower""",22,44,SW,225, 96 , 0.8 ,991,Wednesday,18-12-2024,02:00,20241218_100922.json,2024-12-18 02:00:00
Athenry,12,05n,Rain showers,"""Rain shower""",26,46,SW,225, 97 , 0.8 ,991,Wednesday,18-12-2024,03:00,20241218_100922.json,2024-12-18 03:00:00
Athenry,12,09n,Rain,"""Moderate rain """,28,-,NW,315, 95 , 1.6 ,993,Wednesday,18-12-2024,04:00,20241218_100922.json,2024-12-18 04:00:00
Athenry,10,46n,Light rain ,"""Light rain """,20,44,W,270, 93 , 1.9 ,996,Wednesday,18-12-2024,05:00,20241218_100922.json,2024-12-18 05:00:00
Athenry,10,40n,Light rain showers,"""Recent Rain""",17,-,W,270, 91 , 0.01 ,999,Wednesday,18-12-2024,06:00,20241218_100922.json,2024-12-18 06:00:00
Athenry,9,04n,Cloudy,"""Cloudy""",11,-,W,270, 92 , 0.0 ,1001,Wednesday,18-12-2024,07:00,20241218_100922.json,2024-12-18 07:00:00
Athenry,9,02n,Fair,"""Fair""",9,-,W,270, 92 , 0.0 ,1002,Wednesday,18-12-2024,08:00,20241218_100922.json,2024-12-18 08:00:00
Athenry,9,04d,Cloudy,"""Cloudy""",11,-,W,270, 91 , 0.0 ,1003,Wednesday,18-12-2024,09:00,20241218_100922.json,2024-12-18 09:00:00
Athenry,4,40n,Light rain showers,"""Recent Rain""",17,-,NW,315, 84 , 0.01 ,1008,Thursday,19-12-2024,00:00,20241219_100922.json,2024-12-19 00:00:00
Athenry,4,02n,Fair,"""Fair""",15,-,NW,315, 84 , 0.0 ,1009,Thursday,19-12-2024,01:00,20241219_100922.json,2024-12-19 01:00:00
Athenry,3,40n,Light rain showers,"""Precipitation""",11,-,W,270, 85 , 0.01 ,1009,Thursday,19-12-2024,02:00,20241219_100922.json,2024-12-19 02:00:00
Athenry,3,40n,Light rain showers,"""Recent Precipitation""",9,-,NW,315, 88 , 0.01 ,1010,Thursday,19-12-2024,03:00,20241219_100922.json,2024-12-19 03:00:00
Athenry,3,05n,Rain showers,"""Moderate Rain shower""",15,41,NW,315, 93 , 1.9 ,1011,Thursday,19-12-2024,04:00,20241219_100922.json,2024-12-19 04:00:00
Athenry,4,46n,Light rain ,"""Light rain """,41,-,NW,315, 86 , 0.1 ,1011,Thursday,19-12-2024,05:00,20241219_100922.json,2024-12-19 05:00:00
Athenry,4,02n,Fair,"""Fair""",17,52,W,270, 86 , 0.0 ,1012,Thursday,19-12-2024,06:00,20241219_100922.json,2024-12-19 06:00:00
Athenry,4,02n,Fair,"""Fair""",13,-,NW,315, 87 , 0.0 ,1014,Thursday,19-12-2024,07:00,20241219_100922.json,2024-12-19 07:00:00
Athenry,2,02n,Fair,"""Fair""",4,-,NW,315, 92 , 0.0 ,1015,Thursday,19-12-2024,08:00,20241219_100922.json,2024-12-19 08:00:00
Athenry,3,40d,Light rain showers,"""Recent Rain""",13,-,NW,315, 90 , 0.01 ,1016,Thursday,19-12-2024,09:00,20241219_100922.json,2024-12-19 09:00:00
Athenry,5,46n,Light rain ,"""Light Drizzle """,7,-,S,180, 97 , 0.01 ,1021,Friday,20-12-2024,00:00,20241220_100834.json,2024-12-20 00:00:00
Athenry,6,46n,Light rain ,"""Recent Drizzle """,13,-,SW,225, 95 , 0.01 ,1020,Friday,20-12-2024,01:00,20241220_100834.json,2024-12-20 01:00:00
Athenry,6,46n,Light rain ,"""Recent Drizzle """,13,-,SW,225, 96 , 0.1 ,1019,Friday,20-12-2024,02:00,20241220_100834.json,2024-12-20 02:00:00
Athenry,7,04n,Cloudy,"""Cloudy""",17,-,SW,225, 94 , 0.0 ,1018,Friday,20-12-2024,03:00,20241220_100834.json,2024-12-20 03:00:00
Athenry,8,05n,Rain showers,"""Rain shower""",17,-,SW,225, 94 , 0.7 ,1017,Friday,20-12-2024,04:00,20241220_100834.json,2024-12-20 04:00:00
Athenry,8,05n,Rain showers,"""Rain shower""",17,-,SW,225, 95 , 0.4 ,1016,Friday,20-12-2024,05:00,20241220_100834.json,2024-12-20 05:00:00
Athenry,8,05n,Rain showers,"""Rain shower""",17,-,S,180, 95 , 0.2 ,1014,Friday,20-12-2024,06:00,20241220_100834.json,2024-12-20 06:00:00
Athenry,9,05n,Rain showers,"""Moderate Rain shower""",22,-,SW,225, 94 , 2.5 ,1013,Friday,20-12-2024,07:00,20241220_100834.json,2024-12-20 07:00:00
Athenry,9,46n,Light rain ,"""Light rain """,24,-,SW,225, 92 , 1.4 ,1012,Friday,20-12-2024,08:00,20241220_100834.json,2024-12-20 08:00:00
Athenry,10,05d,Rain showers,"""Rain shower""",19,44,W,270, 95 , 0.6 ,1012,Friday,20-12-2024,09:00,20241220_100834.json,2024-12-20 09:00:00
Athenry,10,04n,Cloudy,"""Cloudy""",22,41,SW,225, 81 , 0.0 ,1014,Saturday,21-12-2024,00:00,20241221_100729.json,2024-12-21 00:00:00
Athenry,10,05n,Rain showers,"""Rain shower""",26,-,SW,225, 85 , 0.01 ,1012,Saturday,21-12-2024,01:00,20241221_100729.json,2024-12-21 01:00:00
Athenry,10,46n,Light rain ,"""Light rain """,28,50,SW,225, 95 , 1.5 ,1011,Saturday,21-12-2024,02:00,20241221_100729.json,2024-12-21 02:00:00
Athenry,10,46n,Light rain ,"""Moderate Drizzle """,33,57,SW,225, 94 , 0.7 ,1010,Saturday,21-12-2024,03:00,20241221_100729.json,2024-12-21 03:00:00
Athenry,11,46n,Light rain ,"""Recent Drizzle """,30,57,SW,225, 94 , 0.01 ,1009,Saturday,21-12-2024,04:00,20241221_100729.json,2024-12-21 04:00:00
Athenry,12,05n,Rain showers,"""Rain shower""",31,56,W,270, 96 , 0.3 ,1008,Saturday,21-12-2024,05:00,20241221_100729.json,2024-12-21 05:00:00
Athenry,11,41n,Heavy rain showers,"""Heavy rain shower""",26,57,W,270, 96 , 3.9 ,1008,Saturday,21-12-2024,06:00,20241221_100729.json,2024-12-21 06:00:00
Athenry,11,46n,Light rain ,"""Recent Drizzle """,33,59,W,270, 82 , 0.1 ,1008,Saturday,21-12-2024,07:00,20241221_100729.json,2024-12-21 07:00:00
Athenry,10,15n,Fog / Mist,"""Mist""",24,61,W,270, 75 , 0.0 ,1008,Saturday,21-12-2024,08:00,20241221_100729.json,2024-12-21 08:00:00
Athenry,10,15d,Fog / Mist,"""Mist""",22,44,W,270, 75 , 0.0 ,1009,Saturday,21-12-2024,09:00,20241221_100729.json,2024-12-21 09:00:00
Athenry,4,05n,Rain showers,"""Moderate Rain shower""",26,59,NW,315, 86 , 0.6 ,1009,Sunday,22-12-2024,00:00,20241222_100727.json,2024-12-22 00:00:00
Athenry,4,05n,Rain showers,"""Rain shower""",28,54,W,270, 85 , 0.2 ,1009,Sunday,22-12-2024,01:00,20241222_100727.json,2024-12-22 01:00:00
Athenry,4,46n,Light rain ,"""Light rain """,15,39,W,270, 78 , 0.01 ,1009,Sunday,22-12-2024,02:00,20241222_100727.json,2024-12-22 02:00:00
Athenry,4,40n,Light rain showers,"""Recent Rain""",20,52,W,270, 80 , 0.1 ,1009,Sunday,22-12-2024,03:00,20241222_100727.json,2024-12-22 03:00:00
Athenry,4,40n,Light rain showers,"""Recent Rain""",20,57,W,270, 88 , 0.2 ,1009,Sunday,22-12-2024,04:00,20241222_100727.json,2024-12-22 04:00:00
Athenry,4,05n,Rain showers,"""Rain shower""",30,83,W,270, 81 , 0.3 ,1009,Sunday,22-12-2024,05:00,20241222_100727.json,2024-12-22 05:00:00
Athenry,4,05n,Rain showers,"""Rain shower""",24,57,W,270, 87 , 0.1 ,1010,Sunday,22-12-2024,06:00,20241222_100727.json,2024-12-22 06:00:00
Athenry,4,05n,Rain showers,"""Rain shower""",26,63,W,270, 87 , 0.4 ,1011,Sunday,22-12-2024,07:00,20241222_100727.json,2024-12-22 07:00:00
Athenry,4,40n,Light rain showers,"""Recent Rain""",26,46,NW,315, 80 , 0.01 ,1012,Sunday,22-12-2024,08:00,20241222_100727.json,2024-12-22 08:00:00
Athenry,5,46d,Light rain ,"""Light rain """,19,-,W,270, 84 , 0.2 ,1013,Sunday,22-12-2024,09:00,20241222_100727.json,2024-12-22 09:00:00
Athenry,5,02n,Fair,"""Fair""",7,-,W,270, 80 , 0.0 ,1028,Monday,23-12-2024,00:00,20241223_100923.json,2024-12-23 00:00:00
Athenry,5,04n,Cloudy,"""Cloudy""",6,-,W,270, 84 , 0.0 ,1028,Monday,23-12-2024,01:00,20241223_100923.json,2024-12-23 01:00:00
Athenry,6,04n,Cloudy,"""Cloudy""",7,-,W,270, 78 , 0.0 ,1028,Monday,23-12-2024,02:00,20241223_100923.json,2024-12-23 02:00:00
Athenry,6,04n,Cloudy,"""Cloudy""",9,-,SW,225, 82 , 0.0 ,1028,Monday,23-12-2024,03:00,20241223_100923.json,2024-12-23 03:00:00
Athenry,6,04n,Cloudy,"""Cloudy""",6,-,SW,225, 84 , 0.0 ,1027,Monday,23-12-2024,04:00,20241223_100923.json,2024-12-23 04:00:00
Athenry,7,46n,Light rain ,"""Moderate Drizzle """,7,-,SW,225, 86 , 0.01 ,1027,Monday,23-12-2024,05:00,20241223_100923.json,2024-12-23 05:00:00
Athenry,7,46n,Light rain ,"""Recent Drizzle """,7,-,SW,225, 97 , 0.1 ,1026,Monday,23-12-2024,06:00,20241223_100923.json,2024-12-23 06:00:00
Athenry,7,15n,Fog / Mist,"""Mist""",7,-,S,180, 98 , 0.1 ,1025,Monday,23-12-2024,07:00,20241223_100923.json,2024-12-23 07:00:00
Athenry,7,46n,Light rain ,"""Moderate Drizzle """,11,-,S,180, 99 , 0.2 ,1025,Monday,23-12-2024,08:00,20241223_100923.json,2024-12-23 08:00:00
Athenry,8,46d,Light rain ,"""Moderate Drizzle """,17,-,SW,225, 99 , 0.2 ,1024,Monday,23-12-2024,09:00,20241223_100923.json,2024-12-23 09:00:00
Athenry,11,46n,Light rain ,"""Moderate Drizzle """,17,-,W,270, 99 , 0.1 ,1024,Tuesday,24-12-2024,00:00,20241224_100831.json,2024-12-24 00:00:00
Athenry,11,46n,Light rain ,"""Moderate Drizzle """,20,-,SW,225, 99 , 0.2 ,1024,Tuesday,24-12-2024,01:00,20241224_100831.json,2024-12-24 01:00:00
Athenry,11,40n,Light rain showers,"""Recent Rain""",20,-,SW,225, 99 , 0.01 ,1024,Tuesday,24-12-2024,02:00,20241224_100831.json,2024-12-24 02:00:00
Athenry,11,46n,Light rain ,"""Recent Drizzle """,22,-,SW,225, 97 , 0.01 ,1024,Tuesday,24-12-2024,03:00,20241224_100831.json,2024-12-24 03:00:00
Athenry,11,04n,Cloudy,"""Cloudy""",22,-,SW,225, 97 , 0.0 ,1024,Tuesday,24-12-2024,04:00,20241224_100831.json,2024-12-24 04:00:00
Athenry,11,04n,Cloudy,"""Cloudy""",24,-,SW,225, 96 , 0.0 ,1024,Tuesday,24-12-2024,05:00,20241224_100831.json,2024-12-24 05:00:00
Athenry,11,15n,Fog / Mist,"""Mist""",19,-,SW,225, 95 , 0.0 ,1024,Tuesday,24-12-2024,06:00,20241224_100831.json,2024-12-24 06:00:00
Athenry,11,04n,Cloudy,"""Cloudy""",22,-,SW,225, 94 , 0.0 ,1024,Tuesday,24-12-2024,07:00,20241224_100831.json,2024-12-24 07:00:00
Athenry,11,04n,Cloudy,"""Cloudy""",20,-,SW,225, 94 , 0.0 ,1024,Tuesday,24-12-2024,08:00,20241224_100831.json,2024-12-24 08:00:00
Athenry,11,04d,Cloudy,"""Cloudy""",17,-,SW,225, 95 , 0.0 ,1024,Tuesday,24-12-2024,09:00,20241224_100831.json,2024-12-24 09:00:00
Athenry,10,46n,Light rain ,"""Recent Drizzle """,17,-,SW,225, 97 , 0.01 ,1026,Wednesday,25-12-2024,00:00,20241225_100829.json,2024-12-25 00:00:00
Athenry,11,46n,Light rain ,"""Recent Drizzle """,17,-,SW,225, 96 , 0.1 ,1026,Wednesday,25-12-2024,01:00,20241225_100829.json,2024-12-25 01:00:00
Athenry,11,04n,Cloudy,"""Cloudy""",20,-,SW,225, 96 , 0.0 ,1026,Wednesday,25-12-2024,02:00,20241225_100829.json,2024-12-25 02:00:00
Athenry,11,04n,Cloudy,"""Cloudy""",17,-,SW,225, 94 , 0.0 ,1026,Wednesday,25-12-2024,03:00,20241225_100829.json,2024-12-25 03:00:00
Athenry,11,04n,Cloudy,"""Cloudy""",15,-,SW,225, 95 , 0.0 ,1026,Wednesday,25-12-2024,04:00,20241225_100829.json,2024-12-25 04:00:00
Athenry,10,05n,Rain showers,"""Rain shower""",13,-,SW,225, 97 , 0.1 ,1026,Wednesday,25-12-2024,05:00,20241225_100829.json,2024-12-25 05:00:00
Athenry,10,46n,Light rain ,"""Moderate Drizzle """,13,-,S,180, 97 , 0.1 ,1026,Wednesday,25-12-2024,06:00,20241225_100829.json,2024-12-25 06:00:00
Athenry,10,05n,Rain showers,"""Rain shower""",11,-,S,180, 98 , 0.3 ,1026,Wednesday,25-12-2024,07:00,20241225_100829.json,2024-12-25 07:00:00
Athenry,10,05n,Rain showers,"""Rain shower""",15,-,SW,225, 98 , 0.3 ,1027,Wednesday,25-12-2024,08:00,20241225_100829.json,2024-12-25 08:00:00
Athenry,10,04d,Cloudy,"""Cloudy""",15,-,S,180, 97 , 0.1 ,1027,Wednesday,25-12-2024,09:00,20241225_100829.json,2024-12-25 09:00:00
Athenry,10,04n,Cloudy,"""Cloudy""",9,-,S,180, 92 , 0.0 ,1030,Thursday,26-12-2024,00:00,20241226_100833.json,2024-12-26 00:00:00
Athenry,10,04n,Cloudy,"""Cloudy""",11,-,S,180, 92 , 0.0 ,1030,Thursday,26-12-2024,01:00,20241226_100833.json,2024-12-26 01:00:00
Athenry,10,04n,Cloudy,"""Cloudy""",11,-,SW,225, 93 , 0.0 ,1030,Thursday,26-12-2024,02:00,20241226_100833.json,2024-12-26 02:00:00
Athenry,10,05n,Rain showers,"""Rain shower""",9,-,S,180, 92 , 0.01 ,1030,Thursday,26-12-2024,03:00,20241226_100833.json,2024-12-26 03:00:00
Athenry,10,46n,Light rain ,"""Recent Drizzle """,6,-,S,180, 93 , 0.01 ,1030,Thursday,26-12-2024,04:00,20241226_100833.json,2024-12-26 04:00:00
Athenry,10,04n,Cloudy,"""Cloudy""",7,-,S,180, 93 , 0.0 ,1030,Thursday,26-12-2024,05:00,20241226_100833.json,2024-12-26 05:00:00
Athenry,9,02n,Fair,"""Fair""",6,-,S,180, 95 , 0.0 ,1031,Thursday,26-12-2024,06:00,20241226_100833.json,2024-12-26 06:00:00
Athenry,9,04n,Cloudy,"""Cloudy""",11,-,S,180, 95 , 0.0 ,1031,Thursday,26-12-2024,07:00,20241226_100833.json,2024-12-26 07:00:00
Athenry,9,04n,Cloudy,"""Cloudy""",13,-,S,180, 95 , 0.0 ,1031,Thursday,26-12-2024,08:00,20241226_100833.json,2024-12-26 08:00:00
Athenry,9,04d,Cloudy,"""Cloudy""",13,-,S,180, 94 , 0.0 ,1032,Thursday,26-12-2024,09:00,20241226_100833.json,2024-12-26 09:00:00
Athenry,9,04n,Cloudy,"""Cloudy""",6,-,S,180, 94 , 0.0 ,1031,Friday,27-12-2024,00:00,20241227_100818.json,2024-12-27 00:00:00
Athenry,9,04n,Cloudy,"""Cloudy""",6,-,S,180, 93 , 0.0 ,1031,Friday,27-12-2024,01:00,20241227_100818.json,2024-12-27 01:00:00
Athenry,10,04n,Cloudy,"""Cloudy""",7,-,S,180, 93 , 0.0 ,1031,Friday,27-12-2024,02:00,20241227_100818.json,2024-12-27 02:00:00
Athenry,9,46n,Light rain ,"""Recent Drizzle """,7,-,S,180, 94 , 0.01 ,1031,Friday,27-12-2024,03:00,20241227_100818.json,2024-12-27 03:00:00
Athenry,9,46n,Light rain ,"""Light Drizzle """,6,-,S,180, 95 , 0.01 ,1031,Friday,27-12-2024,04:00,20241227_100818.json,2024-12-27 04:00:00
Athenry,9,46n,Light rain ,"""Recent Drizzle """,7,-,S,180, 96 , 0.01 ,1031,Friday,27-12-2024,05:00,20241227_100818.json,2024-12-27 05:00:00
Athenry,9,04n,Cloudy,"""Cloudy""",6,-,S,180, 95 , 0.0 ,1031,Friday,27-12-2024,06:00,20241227_100818.json,2024-12-27 06:00:00
Athenry,9,05n,Rain showers,"""Rain shower""",7,-,S,180, 97 , 0.2 ,1031,Friday,27-12-2024,07:00,20241227_100818.json,2024-12-27 07:00:00
Athenry,9,46n,Light rain ,"""Recent Drizzle """,9,-,S,180, 95 , 0.01 ,1031,Friday,27-12-2024,08:00,20241227_100818.json,2024-12-27 08:00:00
Athenry,9,04d,Cloudy,"""Cloudy""",7,-,S,180, 95 , 0.0 ,1031,Friday,27-12-2024,09:00,20241227_100818.json,2024-12-27 09:00:00
Athenry,9,04n,Cloudy,"""Cloudy""",13,-,SW,225, 94 , 0.0 ,1028,Saturday,28-12-2024,00:00,20241228_100727.json,2024-12-28 00:00:00
Athenry,9,04n,Cloudy,"""Cloudy""",13,-,S,180, 95 , 0.0 ,1028,Saturday,28-12-2024,01:00,20241228_100727.json,2024-12-28 01:00:00
Athenry,9,04n,Cloudy,"""Cloudy""",13,-,S,180, 95 , 0.0 ,1028,Saturday,28-12-2024,02:00,20241228_100727.json,2024-12-28 02:00:00
Athenry,8,04n,Cloudy,"""Cloudy""",7,-,S,180, 95 , 0.0 ,1028,Saturday,28-12-2024,03:00,20241228_100727.json,2024-12-28 03:00:00
Athenry,8,04n,Cloudy,"""Cloudy""",9,-,S,180, 95 , 0.0 ,1027,Saturday,28-12-2024,04:00,20241228_100727.json,2024-12-28 04:00:00
Athenry,8,04n,Cloudy,"""Cloudy""",13,-,SW,225, 95 , 0.0 ,1027,Saturday,28-12-2024,05:00,20241228_100727.json,2024-12-28 05:00:00
Athenry,8,46n,Light rain ,"""Recent Drizzle """,11,-,SW,225, 95 , 0.01 ,1027,Saturday,28-12-2024,06:00,20241228_100727.json,2024-12-28 06:00:00
Athenry,8,04n,Cloudy,"""Cloudy""",9,-,S,180, 96 , 0.0 ,1027,Saturday,28-12-2024,07:00,20241228_100727.json,2024-12-28 07:00:00
Athenry,8,04n,Cloudy,"""Cloudy""",13,-,SW,225, 94 , 0.0 ,1027,Saturday,28-12-2024,08:00,20241228_100727.json,2024-12-28 08:00:00
Athenry,8,04d,Cloudy,"""Cloudy""",11,-,S,180, 93 , 0.0 ,1028,Saturday,28-12-2024,09:00,20241228_100727.json,2024-12-28 09:00:00
Athenry,9,04n,Cloudy,"""Cloudy""",11,-,W,270, 82 , 0.0 ,1030,Sunday,29-12-2024,00:00,20241229_100738.json,2024-12-29 00:00:00
Athenry,9,04n,Cloudy,"""Cloudy""",15,-,SW,225, 87 , 0.0 ,1029,Sunday,29-12-2024,01:00,20241229_100738.json,2024-12-29 01:00:00
Athenry,9,04n,Cloudy,"""Cloudy""",11,-,SW,225, 88 , 0.0 ,1029,Sunday,29-12-2024,02:00,20241229_100738.json,2024-12-29 02:00:00
Athenry,9,46n,Light rain ,"""Light Drizzle """,19,-,W,270, 91 , 0.01 ,1029,Sunday,29-12-2024,03:00,20241229_100738.json,2024-12-29 03:00:00
Athenry,9,46n,Light rain ,"""Recent Drizzle """,11,-,W,270, 93 , 0.01 ,1029,Sunday,29-12-2024,04:00,20241229_100738.json,2024-12-29 04:00:00
Athenry,9,04n,Cloudy,"""Cloudy""",13,-,SW,225, 89 , 0.0 ,1029,Sunday,29-12-2024,05:00,20241229_100738.json,2024-12-29 05:00:00
Athenry,9,05n,Rain showers,"""Rain shower""",13,-,W,270, 90 , 0.01 ,1029,Sunday,29-12-2024,06:00,20241229_100738.json,2024-12-29 06:00:00
Athenry,10,04n,Cloudy,"""Cloudy""",19,-,SW,225, 90 , 0.0 ,1028,Sunday,29-12-2024,07:00,20241229_100738.json,2024-12-29 07:00:00
Athenry,10,04n,Cloudy,"""Cloudy""",17,39,W,270, 91 , 0.0 ,1029,Sunday,29-12-2024,08:00,20241229_100738.json,2024-12-29 08:00:00
Athenry,10,05d,Rain showers,"""Rain shower""",17,-,W,270, 93 , 0.01 ,1029,Sunday,29-12-2024,09:00,20241229_100738.json,2024-12-29 09:00:00
Athenry,10,46n,Light rain ,"""Recent Drizzle """,28,-,SW,225, 86 , 0.1 ,1025,Monday,30-12-2024,00:00,20241230_100925.json,2024-12-30 00:00:00
Athenry,10,05n,Rain showers,"""Rain shower""",26,46,SW,225, 89 , 0.2 ,1024,Monday,30-12-2024,01:00,20241230_100925.json,2024-12-30 01:00:00
Athenry,10,04n,Cloudy,"""Cloudy""",31,-,SW,225, 82 , 0.0 ,1024,Monday,30-12-2024,02:00,20241230_100925.json,2024-12-30 02:00:00
Athenry,10,46n,Light rain ,"""Moderate Drizzle """,24,48,SW,225, 86 , 0.01 ,1024,Monday,30-12-2024,03:00,20241230_100925.json,2024-12-30 03:00:00
Athenry,10,46n,Light rain ,"""Recent Drizzle """,30,-,SW,225, 82 , 0.01 ,1023,Monday,30-12-2024,04:00,20241230_100925.json,2024-12-30 04:00:00
Athenry,10,04n,Cloudy,"""Cloudy""",31,52,SW,225, 82 , 0.0 ,1022,Monday,30-12-2024,05:00,20241230_100925.json,2024-12-30 05:00:00
Athenry,10,04n,Cloudy,"""Cloudy""",28,59,SW,225, 83 , 0.0 ,1022,Monday,30-12-2024,06:00,20241230_100925.json,2024-12-30 06:00:00
Athenry,10,46n,Light rain ,"""Moderate Drizzle """,24,54,SW,225, 89 , 0.01 ,1022,Monday,30-12-2024,07:00,20241230_100925.json,2024-12-30 07:00:00
Athenry,10,04n,Cloudy,"""Cloudy""",28,48,SW,225, 83 , 0.0 ,1022,Monday,30-12-2024,08:00,20241230_100925.json,2024-12-30 08:00:00
Athenry,10,04d,Cloudy,"""Cloudy""",22,50,SW,225, 87 , 0.0 ,1022,Monday,30-12-2024,09:00,20241230_100925.json,2024-12-30 09:00:00
Athenry,10,04n,Cloudy,"""Cloudy""",26,-,SW,225, 86 , 0.0 ,1015,Tuesday,31-12-2024,00:00,20241231_100834.json,2024-12-31 00:00:00
Athenry,11,04n,Cloudy,"""Cloudy""",24,50,S,180, 84 , 0.0 ,1015,Tuesday,31-12-2024,01:00,20241231_100834.json,2024-12-31 01:00:00
Athenry,11,04n,Cloudy,"""Cloudy""",22,-,S,180, 85 , 0.0 ,1013,Tuesday,31-12-2024,02:00,20241231_100834.json,2024-12-31 02:00:00
Athenry,11,04n,Cloudy,"""Cloudy""",26,-,SW,225, 82 , 0.0 ,1012,Tuesday,31-12-2024,03:00,20241231_100834.json,2024-12-31 03:00:00
Athenry,11,04n,Cloudy,"""Cloudy""",30,48,SW,225, 82 , 0.0 ,1011,Tuesday,31-12-2024,04:00,20241231_100834.json,2024-12-31 04:00:00
Athenry,11,05n,Rain showers,"""Rain shower""",31,54,S,180, 85 , 0.01 ,1009,Tuesday,31-12-2024,05:00,20241231_100834.json,2024-12-31 05:00:00
Athenry,11,05n,Rain showers,"""Rain shower""",28,57,SW,225, 91 , 1.3 ,1009,Tuesday,31-12-2024,06:00,20241231_100834.json,2024-12-31 06:00:00
Athenry,11,05n,Rain showers,"""Moderate Rain shower""",33,-,SW,225, 93 , 1.0 ,1008,Tuesday,31-12-2024,07:00,20241231_100834.json,2024-12-31 07:00:00
Athenry,11,46n,Light rain ,"""Light rain """,31,52,SW,225, 94 , 2.4 ,1007,Tuesday,31-12-2024,08:00,20241231_100834.json,2024-12-31 08:00:00
Athenry,12,46d,Light rain ,"""Light rain """,33,56,SW,225, 94 , 2.9 ,1006,Tuesday,31-12-2024,09:00,20241231_100834.json,2024-12-31 09:00:00
Athenry,6,46n,Light rain ,"""Light rain """,15,-,W,270, 91 , 1.0 ,1003,Wednesday,01-01-2025,00:00,20250101_100841.json,2025-01-01 00:00:00
Athenry,6,46n,Light rain ,"""Light rain """,15,-,W,270, 91 , 0.6 ,1003,Wednesday,01-01-2025,01:00,20250101_100841.json,2025-01-01 01:00:00
Athenry,6,46n,Light rain ,"""Moderate Drizzle """,13,-,W,270, 89 , 0.4 ,1002,Wednesday,01-01-2025,02:00,20250101_100841.json,2025-01-01 02:00:00
Athenry,6,40n,Light rain showers,"""Recent Rain""",9,-,SW,225, 89 , 0.2 ,1002,Wednesday,01-01-2025,03:00,20250101_100841.json,2025-01-01 03:00:00
Athenry,7,02n,Fair,"""Fair""",20,41,W,270, 81 , 0.0 ,1001,Wednesday,01-01-2025,04:00,20250101_100841.json,2025-01-01 04:00:00
Athenry,6,04n,Cloudy,"""Cloudy""",19,-,W,270, 83 , 0.0 ,1001,Wednesday,01-01-2025,05:00,20250101_100841.json,2025-01-01 05:00:00
Athenry,6,04n,Cloudy,"""Cloudy""",19,39,W,270, 81 , 0.0 ,1002,Wednesday,01-01-2025,06:00,20250101_100841.json,2025-01-01 06:00:00
Athenry,6,05n,Rain showers,"""Rain shower""",13,-,W,270, 86 , 0.01 ,1003,Wednesday,01-01-2025,07:00,20250101_100841.json,2025-01-01 07:00:00
Athenry,6,40n,Light rain showers,"""Recent Rain""",11,-,W,270, 91 , 0.1 ,1003,Wednesday,01-01-2025,08:00,20250101_100841.json,2025-01-01 08:00:00
Athenry,5,46d,Light rain ,"""Recent Drizzle """,7,-,W,270, 90 , 0.01 ,1004,Wednesday,01-01-2025,09:00,20250101_100841.json,2025-01-01 09:00:00
Athenry,1,02n,Fair,"""Fair""",9,-,NE,45, 94 , 0.0 ,1017,Thursday,02-01-2025,00:00,20250102_100827.json,2025-01-02 00:00:00
Athenry,1,02n,Fair,"""Fair""",7,-,N,0, 94 , 0.0 ,1018,Thursday,02-01-2025,01:00,20250102_100827.json,2025-01-02 01:00:00
Athenry,0,02n,Fair,"""Fair""",7,-,N,0, 93 , 0.0 ,1018,Thursday,02-01-2025,02:00,20250102_100827.json,2025-01-02 02:00:00
Athenry,-1,02n,Fair,"""Fair""",6,-,N,0, 93 , 0.0 ,1019,Thursday,02-01-2025,03:00,20250102_100827.json,2025-01-02 03:00:00
Athenry,0,02n,Fair,"""Fair""",9,-,N,0, 93 , 0.0 ,1020,Thursday,02-01-2025,04:00,20250102_100827.json,2025-01-02 04:00:00
Athenry,0,02n,Fair,"""Fair""",9,-,N,0, 90 , 0.0 ,1021,Thursday,02-01-2025,05:00,20250102_100827.json,2025-01-02 05:00:00
Athenry,0,02n,Fair,"""Fair""",7,-,N,0, 92 , 0.0 ,1021,Thursday,02-01-2025,06:00,20250102_100827.json,2025-01-02 06:00:00
Athenry,-1,02n,Fair,"""Fair""",4,-,N,0, 92 , 0.0 ,1023,Thursday,02-01-2025,07:00,20250102_100827.json,2025-01-02 07:00:00
Athenry,-2,02n,Fair,"""Fair""",7,-,N,0, 94 , 0.0 ,1023,Thursday,02-01-2025,08:00,20250102_100827.json,2025-01-02 08:00:00
Athenry,-3,02d,Fair,"""Fair""",7,-,N,0, 95 , 0.0 ,1024,Thursday,02-01-2025,09:00,20250102_100827.json,2025-01-02 09:00:00
Athenry,-4,15n,Fog / Mist,"""Fog thickening""",-,-,,0, 96 , 0.0 ,1029,Friday,03-01-2025,00:00,20250103_100841.json,2025-01-03 00:00:00
Athenry,-4,15n,Fog / Mist,"""Fog patches""",4,-,SW,225, 97 , 0.0 ,1029,Friday,03-01-2025,01:00,20250103_100841.json,2025-01-03 01:00:00
Athenry,-4,15n,Fog / Mist,"""Fog thickening""",-,-,,0, 97 , 0.0 ,1028,Friday,03-01-2025,02:00,20250103_100841.json,2025-01-03 02:00:00
Athenry,-5,15n,Fog / Mist,"""Fog thinning""",4,-,S,180, 96 , 0.0 ,1029,Friday,03-01-2025,03:00,20250103_100841.json,2025-01-03 03:00:00
Athenry,-5,15n,Fog / Mist,"""Recent Fog""",4,-,SW,225, 96 , 0.0 ,1028,Friday,03-01-2025,04:00,20250103_100841.json,2025-01-03 04:00:00
Athenry,-4,15n,Fog / Mist,"""Recent Fog""",6,-,SW,225, 97 , 0.0 ,1028,Friday,03-01-2025,05:00,20250103_100841.json,2025-01-03 05:00:00
Athenry,-4,15n,Fog / Mist,"""Mist""",2,-,SW,225, 96 , 0.0 ,1028,Friday,03-01-2025,06:00,20250103_100841.json,2025-01-03 06:00:00
Athenry,-4,02n,Fair,"""Fair""",2,-,W,270, 97 , 0.0 ,1027,Friday,03-01-2025,07:00,20250103_100841.json,2025-01-03 07:00:00
Athenry,-5,02n,Fair,"""Fair""",4,-,SW,225, 96 , 0.0 ,1028,Friday,03-01-2025,08:00,20250103_100841.json,2025-01-03 08:00:00
Athenry,-4,02d,Fair,"""Fair""",4,-,SW,225, 96 , 0.0 ,1028,Friday,03-01-2025,09:00,20250103_100841.json,2025-01-03 09:00:00
Athenry,0,04n,Cloudy,"""Cloudy""",7,-,S,180, 94 , 0.0 ,1021,Saturday,04-01-2025,00:00,20250104_100740.json,2025-01-04 00:00:00
Athenry,1,04n,Cloudy,"""Cloudy""",7,-,S,180, 94 , 0.0 ,1021,Saturday,04-01-2025,01:00,20250104_100740.json,2025-01-04 01:00:00
Athenry,1,04n,Cloudy,"""Cloudy""",9,-,S,180, 92 , 0.0 ,1020,Saturday,04-01-2025,02:00,20250104_100740.json,2025-01-04 02:00:00
Athenry,1,04n,Cloudy,"""Cloudy""",2,-,S,180, 91 , 0.0 ,1019,Saturday,04-01-2025,03:00,20250104_100740.json,2025-01-04 03:00:00
Athenry,0,04n,Cloudy,"""Cloudy""",4,-,SE,135, 94 , 0.0 ,1018,Saturday,04-01-2025,04:00,20250104_100740.json,2025-01-04 04:00:00
Athenry,0,04n,Cloudy,"""Cloudy""",4,-,S,180, 94 , 0.0 ,1017,Saturday,04-01-2025,05:00,20250104_100740.json,2025-01-04 05:00:00
Athenry,-1,04n,Cloudy,"""Cloudy""",4,-,SE,135, 94 , 0.0 ,1016,Saturday,04-01-2025,06:00,20250104_100740.json,2025-01-04 06:00:00
Athenry,-1,04n,Cloudy,"""Cloudy""",6,-,NE,45, 95 , 0.0 ,1015,Saturday,04-01-2025,07:00,20250104_100740.json,2025-01-04 07:00:00
Athenry,-1,04n,Cloudy,"""Cloudy""",9,-,E,90, 92 , 0.0 ,1014,Saturday,04-01-2025,08:00,20250104_100740.json,2025-01-04 08:00:00
Athenry,0,04d,Cloudy,"""Cloudy""",9,-,E,90, 90 , 0.0 ,1014,Saturday,04-01-2025,09:00,20250104_100740.json,2025-01-04 09:00:00
Athenry,1,47n,Light sleet,"""Light sleet""",13,-,NE,45, 96 , 0.4 ,996,Sunday,05-01-2025,00:00,20250105_100730.json,2025-01-05 00:00:00
Athenry,1,09n,Rain,"""Moderate rain """,13,-,NE,45, 96 , 0.5 ,995,Sunday,05-01-2025,01:00,20250105_100730.json,2025-01-05 01:00:00
Athenry,1,47n,Light sleet,"""Light sleet""",13,-,NE,45, 96 , 0.3 ,994,Sunday,05-01-2025,02:00,20250105_100730.json,2025-01-05 02:00:00
Athenry,1,51n,Light Hail Shower ,"""Ice Pellets""",15,-,NE,45, 95 , 0.2 ,992,Sunday,05-01-2025,03:00,20250105_100730.json,2025-01-05 03:00:00
Athenry,1,46n,Light rain ,"""Recent Drizzle """,15,-,NE,45, 95 , 0.01 ,991,Sunday,05-01-2025,04:00,20250105_100730.json,2025-01-05 04:00:00
Athenry,1,04n,Cloudy,"""Cloudy""",17,-,NE,45, 93 , 0.0 ,991,Sunday,05-01-2025,05:00,20250105_100730.json,2025-01-05 05:00:00
Athenry,2,05n,Rain showers,"""Rain shower""",17,-,NE,45, 92 , 0.01 ,990,Sunday,05-01-2025,06:00,20250105_100730.json,2025-01-05 06:00:00
Athenry,2,46n,Light rain ,"""Light rain """,15,-,NE,45, 92 , 0.01 ,991,Sunday,05-01-2025,07:00,20250105_100730.json,2025-01-05 07:00:00
Athenry,2,46n,Light rain ,"""Light rain """,15,-,NE,45, 92 , 0.2 ,990,Sunday,05-01-2025,08:00,20250105_100730.json,2025-01-05 08:00:00
Athenry,2,46d,Light rain ,"""Light rain """,13,-,NE,45, 92 , 0.01 ,990,Sunday,05-01-2025,09:00,20250105_100730.json,2025-01-05 09:00:00
Athenry,0,02n,Fair,"""Fair""",13,-,NW,315, 94 , 0.0 ,988,Monday,06-01-2025,00:00,20250106_100926.json,2025-01-06 00:00:00
Athenry,0,02n,Fair,"""Fair""",15,-,NW,315, 94 , 0.0 ,988,Monday,06-01-2025,01:00,20250106_100926.json,2025-01-06 01:00:00
Athenry,-1,02n,Fair,"""Fair""",11,-,NW,315, 96 , 0.0 ,987,Monday,06-01-2025,02:00,20250106_100926.json,2025-01-06 02:00:00
Athenry,-1,02n,Fair,"""Fair""",9,-,NW,315, 96 , 0.0 ,987,Monday,06-01-2025,03:00,20250106_100926.json,2025-01-06 03:00:00
Athenry,0,04n,Cloudy,"""Cloudy""",13,-,NW,315, 95 , 0.0 ,987,Monday,06-01-2025,04:00,20250106_100926.json,2025-01-06 04:00:00
Athenry,1,04n,Cloudy,"""Cloudy""",13,-,NW,315, 96 , 0.0 ,988,Monday,06-01-2025,05:00,20250106_100926.json,2025-01-06 05:00:00
Athenry,2,05n,Rain showers,"""Rain shower""",22,-,NW,315, 94 , 0.01 ,988,Monday,06-01-2025,06:00,20250106_100926.json,2025-01-06 06:00:00
Athenry,0,08n,Snow showers,"""Snow shower""",19,-,NW,315, 96 , 0.5 ,989,Monday,06-01-2025,07:00,20250106_100926.json,2025-01-06 07:00:00
Athenry,1,08n,Snow showers,"""Snow shower""",20,-,NW,315, 96 , 1.2 ,990,Monday,06-01-2025,08:00,20250106_100926.json,2025-01-06 08:00:00
Athenry,1,46d,Light rain ,"""Light rain """,15,-,NW,315, 97 , 0.7 ,991,Monday,06-01-2025,09:00,20250106_100926.json,2025-01-06 09:00:00
Athenry,1,05n,Rain showers,"""Rain shower""",26,48,NW,315, 95 , 0.4 ,997,Tuesday,07-01-2025,00:00,20250107_100900.json,2025-01-07 00:00:00
Athenry,1,05n,Rain showers,"""Rain shower""",24,-,NW,315, 95 , 1.1 ,998,Tuesday,07-01-2025,01:00,20250107_100900.json,2025-01-07 01:00:00
Athenry,1,46n,Light rain ,"""Light Drizzle """,11,-,W,270, 94 , 0.01 ,1000,Tuesday,07-01-2025,02:00,20250107_100900.json,2025-01-07 02:00:00
Athenry,2,40n,Light rain showers,"""Recent Rain""",7,-,NW,315, 93 , 0.1 ,1000,Tuesday,07-01-2025,03:00,20250107_100900.json,2025-01-07 03:00:00
Athenry,1,05n,Rain showers,"""Rain shower""",6,-,W,270, 95 , 0.01 ,1000,Tuesday,07-01-2025,04:00,20250107_100900.json,2025-01-07 04:00:00
Athenry,2,40n,Light rain showers,"""Recent Rain""",7,-,NW,315, 93 , 0.01 ,1000,Tuesday,07-01-2025,05:00,20250107_100900.json,2025-01-07 05:00:00
Athenry,1,04n,Cloudy,"""Cloudy""",7,-,W,270, 91 , 0.0 ,1001,Tuesday,07-01-2025,06:00,20250107_100900.json,2025-01-07 06:00:00
Athenry,1,04n,Cloudy,"""Cloudy""",13,-,NW,315, 92 , 0.0 ,1002,Tuesday,07-01-2025,07:00,20250107_100900.json,2025-01-07 07:00:00
Athenry,0,02n,Fair,"""Fair""",7,-,W,270, 94 , 0.0 ,1002,Tuesday,07-01-2025,08:00,20250107_100900.json,2025-01-07 08:00:00
Athenry,0,02d,Fair,"""Fair""",6,-,W,270, 96 , 0.0 ,1003,Tuesday,07-01-2025,09:00,20250107_100900.json,2025-01-07 09:00:00
Athenry,-4,02n,Fair,"""Fair""",-,-,,0, 96 , 0.0 ,1006,Wednesday,08-01-2025,00:00,20250108_100901.json,2025-01-08 00:00:00
Athenry,-4,02n,Fair,"""Fair""",2,-,SW,225, 96 , 0.0 ,1006,Wednesday,08-01-2025,01:00,20250108_100901.json,2025-01-08 01:00:00
Athenry,-4,02n,Fair,"""Fair""",6,-,N,0, 96 , 0.0 ,1006,Wednesday,08-01-2025,02:00,20250108_100901.json,2025-01-08 02:00:00
Athenry,-3,02n,Fair,"""Fair""",7,-,N,0, 96 , 0.0 ,1004,Wednesday,08-01-2025,03:00,20250108_100901.json,2025-01-08 03:00:00
Athenry,-3,02n,Fair,"""Fair""",2,-,E,90, 94 , 0.0 ,1004,Wednesday,08-01-2025,04:00,20250108_100901.json,2025-01-08 04:00:00
Athenry,-3,02n,Fair,"""Fair""",6,-,NE,45, 96 , 0.0 ,1004,Wednesday,08-01-2025,05:00,20250108_100901.json,2025-01-08 05:00:00
Athenry,-4,02n,Fair,"""Fair""",2,-,NE,45, 96 , 0.0 ,1003,Wednesday,08-01-2025,06:00,20250108_100901.json,2025-01-08 06:00:00
Athenry,-3,02n,Fair,"""Fair""",7,-,E,90, 95 , 0.0 ,1003,Wednesday,08-01-2025,07:00,20250108_100901.json,2025-01-08 07:00:00
Athenry,-4,02n,Fair,"""Fair""",2,-,E,90, 94 , 0.0 ,1003,Wednesday,08-01-2025,08:00,20250108_100901.json,2025-01-08 08:00:00
Athenry,-4,02d,Fair,"""Fair""",7,-,E,90, 96 , 0.0 ,1004,Wednesday,08-01-2025,09:00,20250108_100901.json,2025-01-08 09:00:00
Athenry,-5,15n,Fog / Mist,"""Recent Fog""",6,-,NW,315, 95 , 0.0 ,1006,Thursday,09-01-2025,00:00,20250109_100857.json,2025-01-09 00:00:00
Athenry,-6,15n,Fog / Mist,"""Mist""",6,-,NW,315, 96 , 0.0 ,1007,Thursday,09-01-2025,01:00,20250109_100857.json,2025-01-09 01:00:00
Athenry,-6,15n,Fog / Mist,"""Fog thickening""",4,-,SE,135, 95 , 0.0 ,1008,Thursday,09-01-2025,02:00,20250109_100857.json,2025-01-09 02:00:00
Athenry,-7,15n,Fog / Mist,"""Recent Fog""",4,-,SW,225, 93 , 0.0 ,1008,Thursday,09-01-2025,03:00,20250109_100857.json,2025-01-09 03:00:00
Athenry,-6,15n,Fog / Mist,"""Fog patches""",2,-,SW,225, 93 , 0.0 ,1009,Thursday,09-01-2025,04:00,20250109_100857.json,2025-01-09 04:00:00
Athenry,-7,15n,Fog / Mist,"""Mist""",4,-,W,270, 92 , 0.0 ,1009,Thursday,09-01-2025,05:00,20250109_100857.json,2025-01-09 05:00:00
Athenry,-7,15n,Fog / Mist,"""Mist""",2,-,SE,135, 93 , 0.0 ,1010,Thursday,09-01-2025,06:00,20250109_100857.json,2025-01-09 06:00:00
Athenry,-7,15n,Fog / Mist,"""Mist""",4,-,NE,45, 93 , 0.0 ,1011,Thursday,09-01-2025,07:00,20250109_100857.json,2025-01-09 07:00:00
Athenry,-7,02n,Fair,"""Fair""",2,-,SW,225, 92 , 0.0 ,1011,Thursday,09-01-2025,08:00,20250109_100857.json,2025-01-09 08:00:00
Athenry,-7,02d,Fair,"""Fair""",4,-,SW,225, 94 , 0.0 ,1012,Thursday,09-01-2025,09:00,20250109_100857.json,2025-01-09 09:00:00
Athenry,-2,15n,Fog / Mist,"""Mist""",11,-,E,90, 97 , 0.0 ,1015,Friday,10-01-2025,00:00,20250110_100900.json,2025-01-10 00:00:00
Athenry,-3,15n,Fog / Mist,"""Mist""",7,-,SE,135, 96 , 0.0 ,1015,Friday,10-01-2025,01:00,20250110_100900.json,2025-01-10 01:00:00
Athenry,-3,04n,Cloudy,"""Cloudy""",7,-,E,90, 95 , 0.0 ,1015,Friday,10-01-2025,02:00,20250110_100900.json,2025-01-10 02:00:00
Athenry,-2,04n,Cloudy,"""Cloudy""",9,-,E,90, 93 , 0.0 ,1015,Friday,10-01-2025,03:00,20250110_100900.json,2025-01-10 03:00:00
Athenry,-1,04n,Cloudy,"""Cloudy""",6,-,SE,135, 92 , 0.0 ,1015,Friday,10-01-2025,04:00,20250110_100900.json,2025-01-10 04:00:00
Athenry,-1,04n,Cloudy,"""Cloudy""",9,-,E,90, 92 , 0.0 ,1014,Friday,10-01-2025,05:00,20250110_100900.json,2025-01-10 05:00:00
Athenry,0,04n,Cloudy,"""Cloudy""",13,-,E,90, 92 , 0.0 ,1014,Friday,10-01-2025,06:00,20250110_100900.json,2025-01-10 06:00:00
Athenry,-1,49n,Light snow,"""Light snow""",9,-,SE,135, 94 , 0.1 ,1014,Friday,10-01-2025,07:00,20250110_100900.json,2025-01-10 07:00:00
Athenry,0,46n,Light rain ,"""Freezing Drizzle""",15,-,E,90, 96 , 0.2 ,1015,Friday,10-01-2025,08:00,20250110_100900.json,2025-01-10 08:00:00
Athenry,1,04d,Cloudy,"""Cloudy""",11,-,E,90, 91 , 0.0 ,1015,Friday,10-01-2025,09:00,20250110_100900.json,2025-01-10 09:00:00
Athenry,5,46n,Light rain ,"""Moderate Drizzle """,11,-,SE,135, 96 , 0.5 ,1019,Saturday,11-01-2025,00:00,20250111_100731.json,2025-01-11 00:00:00
Athenry,5,46n,Light rain ,"""Recent Drizzle """,9,-,E,90, 95 , 0.01 ,1019,Saturday,11-01-2025,01:00,20250111_100731.json,2025-01-11 01:00:00
Athenry,5,05n,Rain showers,"""Rain shower""",9,-,SE,135, 97 , 0.7 ,1019,Saturday,11-01-2025,02:00,20250111_100731.json,2025-01-11 02:00:00
Athenry,5,46n,Light rain ,"""Moderate Drizzle """,11,-,SE,135, 98 , 0.5 ,1020,Saturday,11-01-2025,03:00,20250111_100731.json,2025-01-11 03:00:00
Athenry,6,46n,Light rain ,"""Moderate Drizzle """,6,-,SE,135, 98 , 0.3 ,1020,Saturday,11-01-2025,04:00,20250111_100731.json,2025-01-11 04:00:00
Athenry,5,15n,Fog / Mist,"""Fog thickening""",2,-,SE,135, 97 , 0.1 ,1021,Saturday,11-01-2025,05:00,20250111_100731.json,2025-01-11 05:00:00
Athenry,5,15n,Fog / Mist,"""Fog""",2,-,SW,225, 99 , 0.0 ,1022,Saturday,11-01-2025,06:00,20250111_100731.json,2025-01-11 06:00:00
Athenry,7,15n,Fog / Mist,"""Recent Fog""",6,-,W,270, 99 , 0.0 ,1023,Saturday,11-01-2025,07:00,20250111_100731.json,2025-01-11 07:00:00
Athenry,7,15n,Fog / Mist,"""Mist""",4,-,W,270, 99 , 0.0 ,1024,Saturday,11-01-2025,08:00,20250111_100731.json,2025-01-11 08:00:00
Athenry,7,46d,Light rain ,"""Recent Drizzle """,6,-,W,270, 99 , 0.1 ,1025,Saturday,11-01-2025,09:00,20250111_100731.json,2025-01-11 09:00:00
Athenry,1,15n,Fog / Mist,"""Recent Fog""",6,-,E,90, 99 , 0.0 ,1032,Sunday,12-01-2025,00:00,20250112_100736.json,2025-01-12 00:00:00
Athenry,1,15n,Fog / Mist,"""Mist""",9,-,E,90, 98 , 0.0 ,1031,Sunday,12-01-2025,01:00,20250112_100736.json,2025-01-12 01:00:00
Athenry,1,02n,Fair,"""Fair""",11,-,E,90, 98 , 0.0 ,1031,Sunday,12-01-2025,02:00,20250112_100736.json,2025-01-12 02:00:00
Athenry,1,02n,Fair,"""Fair""",13,-,E,90, 97 , 0.0 ,1031,Sunday,12-01-2025,03:00,20250112_100736.json,2025-01-12 03:00:00
Athenry,2,02n,Fair,"""Fair""",11,-,E,90, 96 , 0.0 ,1032,Sunday,12-01-2025,04:00,20250112_100736.json,2025-01-12 04:00:00
Athenry,2,04n,Cloudy,"""Cloudy""",9,-,E,90, 96 , 0.0 ,1032,Sunday,12-01-2025,05:00,20250112_100736.json,2025-01-12 05:00:00
Athenry,3,04n,Cloudy,"""Cloudy""",11,-,SE,135, 96 , 0.0 ,1031,Sunday,12-01-2025,06:00,20250112_100736.json,2025-01-12 06:00:00
Athenry,3,04n,Cloudy,"""Cloudy""",11,-,E,90, 96 , 0.0 ,1031,Sunday,12-01-2025,07:00,20250112_100736.json,2025-01-12 07:00:00
Athenry,4,04n,Cloudy,"""Cloudy""",9,-,E,90, 95 , 0.0 ,1031,Sunday,12-01-2025,08:00,20250112_100736.json,2025-01-12 08:00:00
Athenry,5,04d,Cloudy,"""Cloudy""",11,-,E,90, 95 , 0.0 ,1031,Sunday,12-01-2025,09:00,20250112_100736.json,2025-01-12 09:00:00
Athenry,12,04n,Cloudy,"""Cloudy""",11,-,S,180, 91 , 0.0 ,1028,Monday,13-01-2025,00:00,20250113_100940.json,2025-01-13 00:00:00
Athenry,12,04n,Cloudy,"""Cloudy""",11,-,S,180, 90 , 0.0 ,1028,Monday,13-01-2025,01:00,20250113_100940.json,2025-01-13 01:00:00
Athenry,12,04n,Cloudy,"""Cloudy""",15,-,S,180, 91 , 0.0 ,1027,Monday,13-01-2025,02:00,20250113_100940.json,2025-01-13 02:00:00
Athenry,12,04n,Cloudy,"""Cloudy""",19,-,S,180, 89 , 0.0 ,1027,Monday,13-01-2025,03:00,20250113_100940.json,2025-01-13 03:00:00
Athenry,12,04n,Cloudy,"""Cloudy""",17,-,S,180, 88 , 0.0 ,1027,Monday,13-01-2025,04:00,20250113_100940.json,2025-01-13 04:00:00
Athenry,12,04n,Cloudy,"""Cloudy""",19,-,S,180, 88 , 0.0 ,1026,Monday,13-01-2025,05:00,20250113_100940.json,2025-01-13 05:00:00
Athenry,12,04n,Cloudy,"""Cloudy""",19,-,SW,225, 87 , 0.0 ,1026,Monday,13-01-2025,06:00,20250113_100940.json,2025-01-13 06:00:00
Athenry,12,04n,Cloudy,"""Cloudy""",17,-,S,180, 88 , 0.0 ,1027,Monday,13-01-2025,07:00,20250113_100940.json,2025-01-13 07:00:00
Athenry,12,46n,Light rain ,"""Moderate Drizzle """,15,-,S,180, 92 , 0.01 ,1027,Monday,13-01-2025,08:00,20250113_100940.json,2025-01-13 08:00:00
Athenry,12,05d,Rain showers,"""Rain shower""",15,-,S,180, 94 , 0.9 ,1027,Monday,13-01-2025,09:00,20250113_100940.json,2025-01-13 09:00:00
Athenry,11,46n,Light rain ,"""Moderate Drizzle """,13,-,W,270, 99 , 0.7 ,1030,Tuesday,14-01-2025,00:00,20250114_100827.json,2025-01-14 00:00:00
Athenry,11,46n,Light rain ,"""Recent Drizzle """,11,-,SW,225, 99 , 0.2 ,1029,Tuesday,14-01-2025,01:00,20250114_100827.json,2025-01-14 01:00:00
Athenry,11,04n,Cloudy,"""Cloudy""",11,-,SW,225, 98 , 0.0 ,1029,Tuesday,14-01-2025,02:00,20250114_100827.json,2025-01-14 02:00:00
Athenry,11,15n,Fog / Mist,"""Mist""",15,-,SW,225, 99 , 0.0 ,1030,Tuesday,14-01-2025,03:00,20250114_100827.json,2025-01-14 03:00:00
Athenry,11,04n,Cloudy,"""Cloudy""",7,-,W,270, 99 , 0.0 ,1030,Tuesday,14-01-2025,04:00,20250114_100827.json,2025-01-14 04:00:00
Athenry,11,04n,Cloudy,"""Cloudy""",9,-,W,270, 99 , 0.0 ,1030,Tuesday,14-01-2025,05:00,20250114_100827.json,2025-01-14 05:00:00
Athenry,11,15n,Fog / Mist,"""Recent Fog""",9,-,SW,225, 99 , 0.0 ,1030,Tuesday,14-01-2025,06:00,20250114_100827.json,2025-01-14 06:00:00
Athenry,11,15n,Fog / Mist,"""Mist""",6,-,SW,225, 99 , 0.0 ,1030,Tuesday,14-01-2025,07:00,20250114_100827.json,2025-01-14 07:00:00
Athenry,11,05n,Rain showers,"""Rain shower""",9,-,SW,225, 99 , 0.1 ,1030,Tuesday,14-01-2025,08:00,20250114_100827.json,2025-01-14 08:00:00
Athenry,11,15d,Fog / Mist,"""Mist""",4,-,SE,135, 99 , 0.1 ,1031,Tuesday,14-01-2025,09:00,20250114_100827.json,2025-01-14 09:00:00
Athenry,9,02n,Fair,"""Fair""",9,-,S,180, 92 , 0.0 ,1031,Wednesday,15-01-2025,00:00,20250115_100829.json,2025-01-15 00:00:00
Athenry,8,02n,Fair,"""Fair""",9,-,S,180, 90 , 0.0 ,1031,Wednesday,15-01-2025,01:00,20250115_100829.json,2025-01-15 01:00:00
Athenry,7,02n,Fair,"""Fair""",4,-,SW,225, 92 , 0.0 ,1031,Wednesday,15-01-2025,02:00,20250115_100829.json,2025-01-15 02:00:00
Athenry,7,02n,Fair,"""Fair""",11,-,S,180, 92 , 0.0 ,1030,Wednesday,15-01-2025,03:00,20250115_100829.json,2025-01-15 03:00:00
Athenry,7,02n,Fair,"""Fair""",9,-,S,180, 91 , 0.0 ,1030,Wednesday,15-01-2025,04:00,20250115_100829.json,2025-01-15 04:00:00
Athenry,7,02n,Fair,"""Fair""",7,-,S,180, 91 , 0.1 ,1030,Wednesday,15-01-2025,05:00,20250115_100829.json,2025-01-15 05:00:00
Athenry,6,02n,Fair,"""Fair""",11,-,S,180, 91 , 0.0 ,1030,Wednesday,15-01-2025,06:00,20250115_100829.json,2025-01-15 06:00:00
Athenry,5,02n,Fair,"""Fair""",6,-,SE,135, 94 , 0.0 ,1030,Wednesday,15-01-2025,07:00,20250115_100829.json,2025-01-15 07:00:00
Athenry,5,02n,Fair,"""Fair""",6,-,S,180, 92 , 0.0 ,1029,Wednesday,15-01-2025,08:00,20250115_100829.json,2025-01-15 08:00:00
Athenry,5,02d,Fair,"""Fair""",11,-,SE,135, 89 , 0.0 ,1029,Wednesday,15-01-2025,09:00,20250115_100829.json,2025-01-15 09:00:00
Athenry,7,02n,Fair,"""Fair""",7,-,S,180, 90 , 0.0 ,1029,Thursday,16-01-2025,00:00,20250116_100846.json,2025-01-16 00:00:00
Athenry,6,02n,Fair,"""Fair""",7,-,S,180, 93 , 0.0 ,1029,Thursday,16-01-2025,01:00,20250116_100846.json,2025-01-16 01:00:00
Athenry,7,02n,Fair,"""Fair""",6,-,S,180, 92 , 0.0 ,1028,Thursday,16-01-2025,02:00,20250116_100846.json,2025-01-16 02:00:00
Athenry,7,02n,Fair,"""Fair""",7,-,S,180, 92 , 0.0 ,1028,Thursday,16-01-2025,03:00,20250116_100846.json,2025-01-16 03:00:00
Athenry,7,02n,Fair,"""Fair""",7,-,S,180, 93 , 0.0 ,1028,Thursday,16-01-2025,04:00,20250116_100846.json,2025-01-16 04:00:00
Athenry,6,02n,Fair,"""Fair""",6,-,S,180, 93 , 0.0 ,1028,Thursday,16-01-2025,05:00,20250116_100846.json,2025-01-16 05:00:00
Athenry,7,02n,Fair,"""Fair""",6,-,S,180, 93 , 0.0 ,1027,Thursday,16-01-2025,06:00,20250116_100846.json,2025-01-16 06:00:00
Athenry,8,02n,Fair,"""Fair""",9,-,S,180, 89 , 0.0 ,1027,Thursday,16-01-2025,07:00,20250116_100846.json,2025-01-16 07:00:00
Athenry,8,02n,Fair,"""Fair""",9,-,S,180, 88 , 0.0 ,1027,Thursday,16-01-2025,08:00,20250116_100846.json,2025-01-16 08:00:00
Athenry,8,02d,Fair,"""Fair""",7,-,S,180, 88 , 0.0 ,1027,Thursday,16-01-2025,09:00,20250116_100846.json,2025-01-16 09:00:00
Athenry,9,02n,Fair,"""Fair""",20,-,S,180, 83 , 0.0 ,1026,Friday,17-01-2025,00:00,20250117_100830.json,2025-01-17 00:00:00
Athenry,9,02n,Fair,"""Fair""",17,-,S,180, 84 , 0.0 ,1026,Friday,17-01-2025,01:00,20250117_100830.json,2025-01-17 01:00:00
Athenry,9,04n,Cloudy,"""Cloudy""",17,-,S,180, 83 , 0.0 ,1026,Friday,17-01-2025,02:00,20250117_100830.json,2025-01-17 02:00:00
Athenry,10,04n,Cloudy,"""Cloudy""",17,-,S,180, 81 , 0.0 ,1026,Friday,17-01-2025,03:00,20250117_100830.json,2025-01-17 03:00:00
Athenry,10,04n,Cloudy,"""Cloudy""",17,-,S,180, 80 , 0.0 ,1026,Friday,17-01-2025,04:00,20250117_100830.json,2025-01-17 04:00:00
Athenry,10,04n,Cloudy,"""Cloudy""",13,-,S,180, 77 , 0.0 ,1026,Friday,17-01-2025,05:00,20250117_100830.json,2025-01-17 05:00:00
Athenry,10,04n,Cloudy,"""Cloudy""",11,-,S,180, 79 , 0.0 ,1026,Friday,17-01-2025,06:00,20250117_100830.json,2025-01-17 06:00:00
Athenry,10,04n,Cloudy,"""Cloudy""",13,-,S,180, 80 , 0.0 ,1026,Friday,17-01-2025,07:00,20250117_100830.json,2025-01-17 07:00:00
Athenry,10,04n,Cloudy,"""Cloudy""",13,-,S,180, 81 , 0.0 ,1027,Friday,17-01-2025,08:00,20250117_100830.json,2025-01-17 08:00:00
Athenry,10,02d,Fair,"""Fair""",11,-,S,180, 83 , 0.0 ,1028,Friday,17-01-2025,09:00,20250117_100830.json,2025-01-17 09:00:00
Athenry,9,04n,Cloudy,"""Cloudy""",11,-,S,180, 76 , 0.0 ,1026,Saturday,18-01-2025,00:00,20250118_100713.json,2025-01-18 00:00:00
Athenry,9,04n,Cloudy,"""Cloudy""",13,-,S,180, 75 , 0.0 ,1025,Saturday,18-01-2025,01:00,20250118_100713.json,2025-01-18 01:00:00
Athenry,9,04n,Cloudy,"""Cloudy""",17,-,S,180, 74 , 0.0 ,1025,Saturday,18-01-2025,02:00,20250118_100713.json,2025-01-18 02:00:00
Athenry,9,04n,Cloudy,"""Cloudy""",17,39,S,180, 74 , 0.0 ,1024,Saturday,18-01-2025,03:00,20250118_100713.json,2025-01-18 03:00:00
Athenry,9,04n,Cloudy,"""Cloudy""",15,-,S,180, 75 , 0.0 ,1023,Saturday,18-01-2025,04:00,20250118_100713.json,2025-01-18 04:00:00
Athenry,9,04n,Cloudy,"""Cloudy""",15,-,S,180, 74 , 0.0 ,1023,Saturday,18-01-2025,05:00,20250118_100713.json,2025-01-18 05:00:00
Athenry,9,04n,Cloudy,"""Cloudy""",15,39,S,180, 74 , 0.0 ,1023,Saturday,18-01-2025,06:00,20250118_100713.json,2025-01-18 06:00:00
Athenry,9,04n,Cloudy,"""Cloudy""",15,-,S,180, 73 , 0.0 ,1022,Saturday,18-01-2025,07:00,20250118_100713.json,2025-01-18 07:00:00
Athenry,10,04n,Cloudy,"""Cloudy""",13,46,S,180, 71 , 0.0 ,1022,Saturday,18-01-2025,08:00,20250118_100713.json,2025-01-18 08:00:00
Athenry,10,04d,Cloudy,"""Cloudy""",13,-,S,180, 71 , 0.0 ,1022,Saturday,18-01-2025,09:00,20250118_100713.json,2025-01-18 09:00:00
Athenry,10,04n,Cloudy,"""Cloudy""",19,-,S,180, 80 , 0.0 ,1017,Sunday,19-01-2025,00:00,20250119_100721.json,2025-01-19 00:00:00
Athenry,10,04n,Cloudy,"""Cloudy""",13,-,SE,135, 80 , 0.0 ,1017,Sunday,19-01-2025,01:00,20250119_100721.json,2025-01-19 01:00:00
Athenry,10,04n,Cloudy,"""Cloudy""",11,-,S,180, 80 , 0.0 ,1016,Sunday,19-01-2025,02:00,20250119_100721.json,2025-01-19 02:00:00
Athenry,9,04n,Cloudy,"""Cloudy""",15,-,SE,135, 83 , 0.0 ,1016,Sunday,19-01-2025,03:00,20250119_100721.json,2025-01-19 03:00:00
Athenry,9,04n,Cloudy,"""Cloudy""",13,-,SE,135, 84 , 0.0 ,1015,Sunday,19-01-2025,04:00,20250119_100721.json,2025-01-19 04:00:00
Athenry,8,02n,Fair,"""Fair""",17,-,SE,135, 87 , 0.0 ,1015,Sunday,19-01-2025,05:00,20250119_100721.json,2025-01-19 05:00:00
Athenry,8,04n,Cloudy,"""Cloudy""",9,-,SE,135, 87 , 0.0 ,1015,Sunday,19-01-2025,06:00,20250119_100721.json,2025-01-19 06:00:00
Athenry,8,04n,Cloudy,"""Cloudy""",9,-,SE,135, 87 , 0.0 ,1014,Sunday,19-01-2025,07:00,20250119_100721.json,2025-01-19 07:00:00
Athenry,7,02n,Fair,"""Fair""",9,-,SE,135, 91 , 0.0 ,1014,Sunday,19-01-2025,08:00,20250119_100721.json,2025-01-19 08:00:00
Athenry,7,02d,Fair,"""Fair""",9,-,SE,135, 91 , 0.0 ,1014,Sunday,19-01-2025,09:00,20250119_100721.json,2025-01-19 09:00:00
Athenry,9,15n,Fog / Mist,"""Mist""",6,-,S,180, 97 , 0.0 ,1015,Monday,20-01-2025,00:00,20250120_100904.json,2025-01-20 00:00:00
Athenry,9,15n,Fog / Mist,"""Mist""",9,-,SW,225, 97 , 0.0 ,1015,Monday,20-01-2025,01:00,20250120_100904.json,2025-01-20 01:00:00
Athenry,9,15n,Fog / Mist,"""Mist""",7,-,S,180, 98 , 0.0 ,1015,Monday,20-01-2025,02:00,20250120_100904.json,2025-01-20 02:00:00
Athenry,9,15n,Fog / Mist,"""Mist""",7,-,SW,225, 98 , 0.0 ,1015,Monday,20-01-2025,03:00,20250120_100904.json,2025-01-20 03:00:00
Athenry,9,15n,Fog / Mist,"""Mist""",6,-,S,180, 99 , 0.0 ,1015,Monday,20-01-2025,04:00,20250120_100904.json,2025-01-20 04:00:00
Athenry,9,15n,Fog / Mist,"""Mist""",6,-,S,180, 98 , 0.0 ,1015,Monday,20-01-2025,05:00,20250120_100904.json,2025-01-20 05:00:00
Athenry,8,15n,Fog / Mist,"""Mist""",2,-,S,180, 98 , 0.0 ,1015,Monday,20-01-2025,06:00,20250120_100904.json,2025-01-20 06:00:00
Athenry,8,15n,Fog / Mist,"""Recent Fog""",4,-,S,180, 98 , 0.0 ,1015,Monday,20-01-2025,07:00,20250120_100904.json,2025-01-20 07:00:00
Athenry,5,15n,Fog / Mist,"""Fog thickening""",2,-,W,270, 98 , 0.0 ,1015,Monday,20-01-2025,08:00,20250120_100904.json,2025-01-20 08:00:00
Athenry,7,15d,Fog / Mist,"""Fog""",2,-,S,180, 99 , 0.0 ,1016,Monday,20-01-2025,09:00,20250120_100904.json,2025-01-20 09:00:00
Athenry,6,15n,Fog / Mist,"""Fog""",2,-,S,180, 99 , 0.1 ,1013,Tuesday,21-01-2025,00:00,20250121_100830.json,2025-01-21 00:00:00
Athenry,5,15n,Fog / Mist,"""Fog""",4,-,S,180, 99 , 0.0 ,1013,Tuesday,21-01-2025,01:00,20250121_100830.json,2025-01-21 01:00:00
Athenry,5,05n,Rain showers,"""Rain shower""",6,-,S,180, 99 , 0.01 ,1012,Tuesday,21-01-2025,02:00,20250121_100830.json,2025-01-21 02:00:00
Athenry,6,15n,Fog / Mist,"""Fog""",6,-,S,180, 99 , 0.0 ,1012,Tuesday,21-01-2025,03:00,20250121_100830.json,2025-01-21 03:00:00
Athenry,6,05n,Rain showers,"""Rain shower""",6,-,SW,225, 99 , 0.1 ,1012,Tuesday,21-01-2025,04:00,20250121_100830.json,2025-01-21 04:00:00
Athenry,6,05n,Rain showers,"""Rain shower""",4,-,S,180, 99 , 0.3 ,1012,Tuesday,21-01-2025,05:00,20250121_100830.json,2025-01-21 05:00:00
Athenry,6,05n,Rain showers,"""Rain shower""",4,-,SW,225, 99 , 0.1 ,1012,Tuesday,21-01-2025,06:00,20250121_100830.json,2025-01-21 06:00:00
Athenry,5,15n,Fog / Mist,"""Fog thickening""",2,-,SW,225, 99 , 0.1 ,1012,Tuesday,21-01-2025,07:00,20250121_100830.json,2025-01-21 07:00:00
Athenry,5,05n,Rain showers,"""Rain shower""",7,-,S,180, 100 , 0.01 ,1011,Tuesday,21-01-2025,08:00,20250121_100830.json,2025-01-21 08:00:00
Athenry,4,15d,Fog / Mist,"""Fog""",4,-,S,180, 99 , 0.1 ,1012,Tuesday,21-01-2025,09:00,20250121_100830.json,2025-01-21 09:00:00
Athenry,3,15n,Fog / Mist,"""Fog""",4,-,S,180, 99 , 0.0 ,1008,Wednesday,22-01-2025,00:00,20250122_100716.json,2025-01-22 00:00:00
Athenry,3,15n,Fog / Mist,"""Fog thinning""",4,-,SW,225, 99 , 0.0 ,1007,Wednesday,22-01-2025,01:00,20250122_100716.json,2025-01-22 01:00:00
Athenry,4,15n,Fog / Mist,"""Fog thickening""",6,-,SW,225, 99 , 0.0 ,1007,Wednesday,22-01-2025,02:00,20250122_100716.json,2025-01-22 02:00:00
Athenry,3,15n,Fog / Mist,"""Fog thinning""",-,-,,0, 99 , 0.0 ,1007,Wednesday,22-01-2025,03:00,20250122_100716.json,2025-01-22 03:00:00
Athenry,2,15n,Fog / Mist,"""Fog thickening""",2,-,S,180, 99 , 0.1 ,1006,Wednesday,22-01-2025,04:00,20250122_100716.json,2025-01-22 04:00:00
Athenry,1,15n,Fog / Mist,"""Fog thinning""",2,-,S,180, 99 , 0.0 ,1006,Wednesday,22-01-2025,05:00,20250122_100716.json,2025-01-22 05:00:00
Athenry,0,15n,Fog / Mist,"""Fog thinning""",2,-,S,180, 99 , 0.0 ,1006,Wednesday,22-01-2025,06:00,20250122_100716.json,2025-01-22 06:00:00
Athenry,0,15n,Fog / Mist,"""Fog""",2,-,SE,135, 99 , 0.0 ,1006,Wednesday,22-01-2025,07:00,20250122_100716.json,2025-01-22 07:00:00
Athenry,0,15n,Fog / Mist,"""Fog thickening""",4,-,SE,135, 99 , 0.0 ,1006,Wednesday,22-01-2025,08:00,20250122_100716.json,2025-01-22 08:00:00
Athenry,0,15d,Fog / Mist,"""Fog thinning""",4,-,S,180, 99 , 0.0 ,1006,Wednesday,22-01-2025,09:00,20250122_100716.json,2025-01-22 09:00:00
Athenry,4,04n,Cloudy,"""Cloudy""",11,-,S,180, 97 , 0.0 ,1001,Thursday,23-01-2025,00:00,20250123_100837.json,2025-01-23 00:00:00
Athenry,4,04n,Cloudy,"""Cloudy""",9,-,S,180, 97 , 0.1 ,1000,Thursday,23-01-2025,01:00,20250123_100837.json,2025-01-23 01:00:00
Athenry,5,04n,Cloudy,"""Cloudy""",11,-,S,180, 95 , 0.0 ,998,Thursday,23-01-2025,02:00,20250123_100837.json,2025-01-23 02:00:00
Athenry,6,04n,Cloudy,"""Cloudy""",9,-,S,180, 95 , 0.0 ,997,Thursday,23-01-2025,03:00,20250123_100837.json,2025-01-23 03:00:00
Athenry,6,04n,Cloudy,"""Cloudy""",9,-,S,180, 92 , 0.0 ,995,Thursday,23-01-2025,04:00,20250123_100837.json,2025-01-23 04:00:00
Athenry,6,46n,Light rain ,"""Light rain """,15,-,S,180, 89 , 0.6 ,993,Thursday,23-01-2025,05:00,20250123_100837.json,2025-01-23 05:00:00
Athenry,6,40n,Light rain showers,"""Recent Rain""",15,-,S,180, 93 , 0.9 ,990,Thursday,23-01-2025,06:00,20250123_100837.json,2025-01-23 06:00:00
Athenry,7,05n,Rain showers,"""Rain shower""",28,54,S,180, 93 , 0.4 ,990,Thursday,23-01-2025,07:00,20250123_100837.json,2025-01-23 07:00:00
Athenry,5,05n,Rain showers,"""Rain shower""",9,61,SW,225, 94 , 1.9 ,990,Thursday,23-01-2025,08:00,20250123_100837.json,2025-01-23 08:00:00
Athenry,5,05d,Rain showers,"""Rain shower""",9,41,W,270, 91 , 1.0 ,991,Thursday,23-01-2025,09:00,20250123_100837.json,2025-01-23 09:00:00
Athenry,9,05n,Rain showers,"""Rain shower""",28,54,S,180, 92 , 2.5 ,968,Friday,24-01-2025,00:00,20250124_100836.json,2025-01-24 00:00:00
Athenry,12,05n,Rain showers,"""Rain shower""",31,61,S,180, 89 , 0.5 ,964,Friday,24-01-2025,01:00,20250124_100836.json,2025-01-24 01:00:00
Athenry,11,40n,Light rain showers,"""Recent Rain""",59,109,SW,225, 61 , 1.7 ,962,Friday,24-01-2025,02:00,20250124_100836.json,2025-01-24 02:00:00
Athenry,8,,N/A,,65,100,SW,225,-99, 0.0 ,960,Friday,24-01-2025,03:00,20250124_100836.json,2025-01-24 03:00:00
Athenry,7,,N/A,,74,122,SW,225, 82 , 0.4 ,960,Friday,24-01-2025,04:00,20250124_100836.json,2025-01-24 04:00:00
Athenry,7,,N/A,,76,139,SW,225, 80 , 0.1 ,963,Friday,24-01-2025,05:00,20250124_100836.json,2025-01-24 05:00:00
Athenry,7,,N/A,,57,126,W,270, 77 , 0.0 ,967,Friday,24-01-2025,06:00,20250124_100836.json,2025-01-24 06:00:00
Athenry,6,,N/A,,52,113,W,270, 83 , 0.5 ,971,Friday,24-01-2025,07:00,20250124_100836.json,2025-01-24 07:00:00
Athenry,5,,N/A,,61,104,W,270, 83 , 2.1 ,975,Friday,24-01-2025,08:00,20250124_100836.json,2025-01-24 08:00:00
Athenry,6,,N/A,,43,104,W,270, 75 , 0.3 ,978,Friday,24-01-2025,09:00,20250124_100836.json,2025-01-24 09:00:00
Athenry,1,,N/A,,9,-,W,270, 84 , 0.0 ,996,Saturday,25-01-2025,00:00,20250125_100721.json,2025-01-25 00:00:00
Athenry,2,,N/A,,4,-,S,180, 86 , 0.0 ,997,Saturday,25-01-2025,01:00,20250125_100721.json,2025-01-25 01:00:00
Athenry,2,,N/A,,9,-,W,270, 78 , 0.0 ,997,Saturday,25-01-2025,02:00,20250125_100721.json,2025-01-25 02:00:00
Athenry,1,,N/A,,2,-,E,90, 83 , 0.0 ,998,Saturday,25-01-2025,03:00,20250125_100721.json,2025-01-25 03:00:00
Athenry,0,,N/A,,7,-,NW,315, 91 , 0.0 ,998,Saturday,25-01-2025,04:00,20250125_100721.json,2025-01-25 04:00:00
Athenry,-1,,N/A,,4,-,S,180, 90 , 0.0 ,998,Saturday,25-01-2025,05:00,20250125_100721.json,2025-01-25 05:00:00
Athenry,0,,N/A,,7,-,S,180, 90 , 0.0 ,,Saturday,25-01-2025,06:00,20250125_100721.json,2025-01-25 06:00:00
Athenry,0,,N/A,,2,-,SW,225, 88 , 0.0 ,,Saturday,25-01-2025,07:00,20250125_100721.json,2025-01-25 07:00:00
Athenry,1,,N/A,,9,-,S,180, 92 , 0.0 ,,Saturday,25-01-2025,08:00,20250125_100721.json,2025-01-25 08:00:00
Athenry,1,,N/A,,9,-,S,180, 90 , 0.0 ,,Saturday,25-01-2025,09:00,20250125_100721.json,2025-01-25 09:00:00
Athenry,1,,N/A,,11,-,S,180, 94 , 0.0 ,999,Sunday,26-01-2025,00:00,20250126_100707.json,2025-01-26 00:00:00
Athenry,1,,N/A,,6,-,S,180, 92 , 0.0 ,998,Sunday,26-01-2025,01:00,20250126_100707.json,2025-01-26 01:00:00
Athenry,0,,N/A,,7,-,E,90, 93 , 0.0 ,997,Sunday,26-01-2025,02:00,20250126_100707.json,2025-01-26 02:00:00
Athenry,-1,,N/A,,7,-,E,90, 94 , 0.0 ,995,Sunday,26-01-2025,03:00,20250126_100707.json,2025-01-26 03:00:00
Athenry,0,,N/A,,15,-,E,90, 94 , 0.0 ,993,Sunday,26-01-2025,04:00,20250126_100707.json,2025-01-26 04:00:00
Athenry,0,,N/A,,20,-,E,90, 92 , 0.0 ,991,Sunday,26-01-2025,05:00,20250126_100707.json,2025-01-26 05:00:00
Athenry,1,,N/A,,13,-,E,90, 91 , 0.0 ,988,Sunday,26-01-2025,06:00,20250126_100707.json,2025-01-26 06:00:00
Athenry,2,,N/A,,24,-,E,90, 87 , 0.0 ,986,Sunday,26-01-2025,07:00,20250126_100707.json,2025-01-26 07:00:00
Athenry,3,,N/A,,26,-,E,90, 88 , 0.1 ,982,Sunday,26-01-2025,08:00,20250126_100707.json,2025-01-26 08:00:00
Athenry,3,,N/A,,35,-,E,90, 88 , 0.0 ,979,Sunday,26-01-2025,09:00,20250126_100707.json,2025-01-26 09:00:00
Athenry,6,,N/A,,20,-,S,180, 80 , 0.0 ,964,Monday,27-01-2025,00:00,20250127_100920.json,2025-01-27 00:00:00
Athenry,6,,N/A,,22,-,SE,135, 80 , 0.0 ,963,Monday,27-01-2025,01:00,20250127_100920.json,2025-01-27 01:00:00
Athenry,6,,N/A,,26,-,SE,135, 79 , 0.0 ,962,Monday,27-01-2025,02:00,20250127_100920.json,2025-01-27 02:00:00
Athenry,6,,N/A,,28,-,SE,135, 80 , 0.0 ,961,Monday,27-01-2025,03:00,20250127_100920.json,2025-01-27 03:00:00
Athenry,6,,N/A,,28,-,S,180, 80 , 0.0 ,960,Monday,27-01-2025,04:00,20250127_100920.json,2025-01-27 04:00:00
Athenry,6,,N/A,,20,-,SE,135, 83 , 0.0 ,960,Monday,27-01-2025,05:00,20250127_100920.json,2025-01-27 05:00:00
Athenry,6,,N/A,,13,-,SE,135, 88 , 0.0 ,959,Monday,27-01-2025,06:00,20250127_100920.json,2025-01-27 06:00:00
Athenry,6,,N/A,,15,-,SE,135, 91 , 0.1 ,959,Monday,27-01-2025,07:00,20250127_100920.json,2025-01-27 07:00:00
Athenry,7,,N/A,,20,-,S,180, 86 , 0.0 ,959,Monday,27-01-2025,08:00,20250127_100920.json,2025-01-27 08:00:00
Athenry,7,,N/A,,24,-,S,180, 82 , 0.0 ,960,Monday,27-01-2025,09:00,20250127_100920.json,2025-01-27 09:00:00
Athenry,7,,N/A,,22,-,N,0, 95 , 0.0 ,972,Tuesday,28-01-2025,00:00,20250128_100827.json,2025-01-28 00:00:00
Athenry,7,,N/A,,22,-,N,0, 94 , 0.1 ,974,Tuesday,28-01-2025,01:00,20250128_100827.json,2025-01-28 01:00:00
Athenry,7,,N/A,,28,-,NW,315, 93 , 0.0 ,975,Tuesday,28-01-2025,02:00,20250128_100827.json,2025-01-28 02:00:00
Athenry,6,,N/A,,24,43,NW,315, 91 , 0.0 ,977,Tuesday,28-01-2025,03:00,20250128_100827.json,2025-01-28 03:00:00
Athenry,6,,N/A,,22,-,NW,315, 86 , 0.0 ,978,Tuesday,28-01-2025,04:00,20250128_100827.json,2025-01-28 04:00:00
Athenry,7,,N/A,,24,-,NW,315, 85 , 0.1 ,980,Tuesday,28-01-2025,05:00,20250128_100827.json,2025-01-28 05:00:00
Athenry,7,,N/A,,24,-,NW,315, 87 , 0.0 ,982,Tuesday,28-01-2025,06:00,20250128_100827.json,2025-01-28 06:00:00
Athenry,7,,N/A,,24,-,NW,315, 89 , 0.0 ,983,Tuesday,28-01-2025,07:00,20250128_100827.json,2025-01-28 07:00:00
Athenry,7,,N/A,,19,-,NW,315, 89 , 0.0 ,986,Tuesday,28-01-2025,08:00,20250128_100827.json,2025-01-28 08:00:00
Athenry,6,02d,Fair,"""Fair""",17,-,NW,315, 93 , 0.0 ,987,Tuesday,28-01-2025,09:00,20250128_100827.json,2025-01-28 09:00:00
Athenry,2,,N/A,,2,-,W,270, 93 , 0.0 ,1001,Wednesday,29-01-2025,00:00,20250129_100823.json,2025-01-29 00:00:00
Athenry,1,,N/A,,2,-,S,180, 95 , 0.0 ,1001,Wednesday,29-01-2025,01:00,20250129_100823.json,2025-01-29 01:00:00
Athenry,-1,,N/A,,-,-,,0, 96 , 0.0 ,1001,Wednesday,29-01-2025,02:00,20250129_100823.json,2025-01-29 02:00:00
Athenry,-1,,N/A,,4,-,S,180, 97 , 0.0 ,1001,Wednesday,29-01-2025,03:00,20250129_100823.json,2025-01-29 03:00:00
Athenry,-1,,N/A,,4,-,N,0, 97 , 0.0 ,1001,Wednesday,29-01-2025,04:00,20250129_100823.json,2025-01-29 04:00:00
Athenry,-1,,N/A,,4,-,N,0, 98 , 0.0 ,1002,Wednesday,29-01-2025,05:00,20250129_100823.json,2025-01-29 05:00:00
Athenry,1,,N/A,,9,-,N,0, 99 , 0.0 ,1003,Wednesday,29-01-2025,06:00,20250129_100823.json,2025-01-29 06:00:00
Athenry,0,,N/A,,7,-,N,0, 97 , 0.0 ,1003,Wednesday,29-01-2025,07:00,20250129_100823.json,2025-01-29 07:00:00
Athenry,0,,N/A,,7,-,N,0, 97 , 0.0 ,1004,Wednesday,29-01-2025,08:00,20250129_100823.json,2025-01-29 08:00:00
Athenry,0,02d,Fair,"""Fair""",9,-,NW,315, 97 , 0.1 ,1006,Wednesday,29-01-2025,09:00,20250129_100823.json,2025-01-29 09:00:00
Athenry,1,02n,Fair,"""Fair""",9,-,W,270, 91 , 0.0 ,1020,Thursday,30-01-2025,00:00,20250130_100818.json,2025-01-30 00:00:00
Athenry,2,02n,Fair,"""Fair""",9,-,W,270, 84 , 0.0 ,1021,Thursday,30-01-2025,01:00,20250130_100818.json,2025-01-30 01:00:00
Athenry,1,02n,Fair,"""Fair""",11,-,NW,315, 85 , 0.0 ,1021,Thursday,30-01-2025,02:00,20250130_100818.json,2025-01-30 02:00:00
Athenry,0,02n,Fair,"""Fair""",4,-,N,0, 90 , 0.0 ,1021,Thursday,30-01-2025,03:00,20250130_100818.json,2025-01-30 03:00:00
Athenry,-2,02n,Fair,"""Fair""",2,-,SE,135, 94 , 0.0 ,1021,Thursday,30-01-2025,04:00,20250130_100818.json,2025-01-30 04:00:00
Athenry,-3,02n,Fair,"""Fair""",4,-,S,180, 94 , 0.0 ,1022,Thursday,30-01-2025,05:00,20250130_100818.json,2025-01-30 05:00:00
Athenry,-2,02n,Fair,"""Fair""",2,-,S,180, 96 , 0.0 ,1022,Thursday,30-01-2025,06:00,20250130_100818.json,2025-01-30 06:00:00
Athenry,-1,02n,Fair,"""Fair""",7,-,S,180, 96 , 0.0 ,1022,Thursday,30-01-2025,07:00,20250130_100818.json,2025-01-30 07:00:00
Athenry,-2,02n,Fair,"""Fair""",4,-,SW,225, 96 , 0.0 ,1023,Thursday,30-01-2025,08:00,20250130_100818.json,2025-01-30 08:00:00
Athenry,0,04d,Cloudy,"""Cloudy""",6,-,S,180, 96 , 0.0 ,1023,Thursday,30-01-2025,09:00,20250130_100818.json,2025-01-30 09:00:00
Athenry,7,02n,Fair,"""Fair""",11,-,W,270, 93 , 0.0 ,1020,Friday,31-01-2025,00:00,20250131_100812.json,2025-01-31 00:00:00
Athenry,5,02n,Fair,"""Fair""",13,-,W,270, 87 , 0.0 ,1021,Friday,31-01-2025,01:00,20250131_100812.json,2025-01-31 01:00:00
Athenry,5,02n,Fair,"""Fair""",11,-,W,270, 88 , 0.0 ,1022,Friday,31-01-2025,02:00,20250131_100812.json,2025-01-31 02:00:00
Athenry,3,15n,Fog / Mist,"""Mist""",6,-,SW,225, 93 , 0.0 ,1023,Friday,31-01-2025,03:00,20250131_100812.json,2025-01-31 03:00:00
Athenry,2,02n,Fair,"""Fair""",4,-,NE,45, 92 , 0.0 ,1023,Friday,31-01-2025,04:00,20250131_100812.json,2025-01-31 04:00:00
Athenry,0,02n,Fair,"""Fair""",4,-,NW,315, 96 , 0.0 ,1024,Friday,31-01-2025,05:00,20250131_100812.json,2025-01-31 05:00:00
Athenry,2,02n,Fair,"""Fair""",7,-,W,270, 95 , 0.0 ,1025,Friday,31-01-2025,06:00,20250131_100812.json,2025-01-31 06:00:00
Athenry,1,02n,Fair,"""Fair""",4,-,S,180, 96 , 0.0 ,1026,Friday,31-01-2025,07:00,20250131_100812.json,2025-01-31 07:00:00
Athenry,1,04n,Cloudy,"""Cloudy""",4,-,NW,315, 96 , 0.0 ,1026,Friday,31-01-2025,08:00,20250131_100812.json,2025-01-31 08:00:00
Athenry,1,02d,Fair,"""Fair""",4,-,S,180, 96 , 0.0 ,1026,Friday,31-01-2025,09:00,20250131_100812.json,2025-01-31 09:00:00
Athenry,6,04n,Cloudy,"""Cloudy""",9,-,SE,135, 80 , 0.0 ,1024,Saturday,01-02-2025,00:00,20250201_100742.json,2025-02-01 00:00:00
Athenry,7,04n,Cloudy,"""Cloudy""",11,-,SE,135, 81 , 0.0 ,1024,Saturday,01-02-2025,01:00,20250201_100742.json,2025-02-01 01:00:00
Athenry,7,04n,Cloudy,"""Cloudy""",13,-,SE,135, 80 , 0.0 ,1023,Saturday,01-02-2025,02:00,20250201_100742.json,2025-02-01 02:00:00
Athenry,8,04n,Cloudy,"""Cloudy""",15,-,SE,135, 82 , 0.0 ,1022,Saturday,01-02-2025,03:00,20250201_100742.json,2025-02-01 03:00:00
Athenry,8,04n,Cloudy,"""Cloudy""",13,-,S,180, 82 , 0.0 ,1022,Saturday,01-02-2025,04:00,20250201_100742.json,2025-02-01 04:00:00
Athenry,8,05n,Rain showers,"""Rain shower""",17,-,SE,135, 84 , 0.01 ,1021,Saturday,01-02-2025,05:00,20250201_100742.json,2025-02-01 05:00:00
Athenry,8,46n,Light rain ,"""Recent Drizzle """,19,-,S,180, 84 , 0.01 ,1020,Saturday,01-02-2025,06:00,20250201_100742.json,2025-02-01 06:00:00
Athenry,8,04n,Cloudy,"""Cloudy""",13,-,S,180, 84 , 0.0 ,1020,Saturday,01-02-2025,07:00,20250201_100742.json,2025-02-01 07:00:00
Athenry,9,04d,Cloudy,"""Cloudy""",19,-,S,180, 83 , 0.0 ,1020,Saturday,01-02-2025,08:00,20250201_100742.json,2025-02-01 08:00:00
Athenry,9,04d,Cloudy,"""Cloudy""",20,41,S,180, 84 , 0.0 ,1019,Saturday,01-02-2025,09:00,20250201_100742.json,2025-02-01 09:00:00
Athenry,9,10n,Heavy rain ,"""Heavy rain """,17,-,SW,225, 95 , 2.4 ,1009,Sunday,02-02-2025,00:00,20250202_100708.json,2025-02-02 00:00:00
Athenry,8,46n,Light rain ,"""Moderate Drizzle """,13,-,W,270, 97 , 1.0 ,1010,Sunday,02-02-2025,01:00,20250202_100708.json,2025-02-02 01:00:00
Athenry,7,09n,Rain,"""Moderate rain """,11,-,W,270, 97 , 2.3 ,1011,Sunday,02-02-2025,02:00,20250202_100708.json,2025-02-02 02:00:00
Athenry,7,09n,Rain,"""Moderate rain """,9,-,W,270, 97 , 2.6 ,1011,Sunday,02-02-2025,03:00,20250202_100708.json,2025-02-02 03:00:00
Athenry,7,46n,Light rain ,"""Light rain """,9,-,W,270, 98 , 1.5 ,1012,Sunday,02-02-2025,04:00,20250202_100708.json,2025-02-02 04:00:00
Athenry,7,46n,Light rain ,"""Light rain """,6,-,W,270, 98 , 0.8 ,1012,Sunday,02-02-2025,05:00,20250202_100708.json,2025-02-02 05:00:00
Athenry,7,46n,Light rain ,"""Light Drizzle """,6,-,W,270, 98 , 0.3 ,1014,Sunday,02-02-2025,06:00,20250202_100708.json,2025-02-02 06:00:00
Athenry,6,46n,Light rain ,"""Light rain """,22,-,NW,315, 94 , 0.3 ,1014,Sunday,02-02-2025,07:00,20250202_100708.json,2025-02-02 07:00:00
Athenry,5,46d,Light rain ,"""Light Drizzle """,15,-,NW,315, 93 , 0.1 ,1016,Sunday,02-02-2025,08:00,20250202_100708.json,2025-02-02 08:00:00
Athenry,3,02d,Fair,"""Fair""",4,-,N,0, 94 , 0.0 ,1016,Sunday,02-02-2025,09:00,20250202_100708.json,2025-02-02 09:00:00
Athenry,8,04n,Cloudy,"""Cloudy""",19,-,S,180, 81 , 0.0 ,1017,Monday,03-02-2025,00:00,20250203_100854.json,2025-02-03 00:00:00
Athenry,9,04n,Cloudy,"""Cloudy""",15,-,S,180, 83 , 0.0 ,1017,Monday,03-02-2025,01:00,20250203_100854.json,2025-02-03 01:00:00
Athenry,9,04n,Cloudy,"""Cloudy""",17,-,S,180, 85 , 0.0 ,1016,Monday,03-02-2025,02:00,20250203_100854.json,2025-02-03 02:00:00
Athenry,9,02n,Fair,"""Fair""",15,-,S,180, 86 , 0.0 ,1016,Monday,03-02-2025,03:00,20250203_100854.json,2025-02-03 03:00:00
Athenry,10,04n,Cloudy,"""Cloudy""",17,-,S,180, 86 , 0.0 ,1015,Monday,03-02-2025,04:00,20250203_100854.json,2025-02-03 04:00:00
Athenry,10,04n,Cloudy,"""Cloudy""",19,-,S,180, 88 , 0.0 ,1015,Monday,03-02-2025,05:00,20250203_100854.json,2025-02-03 05:00:00
Athenry,10,04n,Cloudy,"""Cloudy""",19,-,S,180, 86 , 0.0 ,1014,Monday,03-02-2025,06:00,20250203_100854.json,2025-02-03 06:00:00
Athenry,10,04n,Cloudy,"""Cloudy""",20,-,S,180, 85 , 0.0 ,1014,Monday,03-02-2025,07:00,20250203_100854.json,2025-02-03 07:00:00
Athenry,10,04d,Cloudy,"""Cloudy""",11,-,S,180, 87 , 0.0 ,1013,Monday,03-02-2025,08:00,20250203_100854.json,2025-02-03 08:00:00
Athenry,11,04d,Cloudy,"""Cloudy""",17,-,S,180, 82 , 0.0 ,1013,Monday,03-02-2025,09:00,20250203_100854.json,2025-02-03 09:00:00
Athenry,11,46n,Light rain ,"""Light rain """,24,-,S,180, 94 , 0.3 ,1006,Tuesday,04-02-2025,00:00,20250204_100909.json,2025-02-04 00:00:00
Athenry,11,46n,Light rain ,"""Light rain """,24,46,S,180, 94 , 0.6 ,1006,Tuesday,04-02-2025,01:00,20250204_100909.json,2025-02-04 01:00:00
Athenry,9,10n,Heavy rain ,"""Heavy rain """,17,44,W,270, 96 , 4.2 ,1006,Tuesday,04-02-2025,02:00,20250204_100909.json,2025-02-04 02:00:00
Athenry,9,09n,Rain,"""Moderate rain """,11,-,SW,225, 97 , 1.8 ,1006,Tuesday,04-02-2025,03:00,20250204_100909.json,2025-02-04 03:00:00
Athenry,8,05n,Rain showers,"""Rain shower""",9,-,W,270, 97 , 1.6 ,1007,Tuesday,04-02-2025,04:00,20250204_100909.json,2025-02-04 04:00:00
Athenry,8,04n,Cloudy,"""Cloudy""",13,-,SW,225, 96 , 0.0 ,1007,Tuesday,04-02-2025,05:00,20250204_100909.json,2025-02-04 05:00:00
Athenry,8,40n,Light rain showers,"""Recent Rain""",11,-,SW,225, 95 , 0.1 ,1007,Tuesday,04-02-2025,06:00,20250204_100909.json,2025-02-04 06:00:00
Athenry,8,04n,Cloudy,"""Cloudy""",9,-,S,180, 95 , 0.1 ,1008,Tuesday,04-02-2025,07:00,20250204_100909.json,2025-02-04 07:00:00
Athenry,7,02d,Fair,"""Fair""",9,-,S,180, 95 , 0.0 ,1008,Tuesday,04-02-2025,08:00,20250204_100909.json,2025-02-04 08:00:00
Athenry,7,02d,Fair,"""Fair""",15,-,SW,225, 93 , 0.0 ,1009,Tuesday,04-02-2025,09:00,20250204_100909.json,2025-02-04 09:00:00
Athenry,5,04n,Cloudy,"""Cloudy""",9,-,W,270, 86 , 0.5 ,1026,Wednesday,05-02-2025,00:00,20250205_100840.json,2025-02-05 00:00:00
Athenry,4,02n,Fair,"""Fair""",9,-,W,270, 87 , 0.1 ,1027,Wednesday,05-02-2025,01:00,20250205_100840.json,2025-02-05 01:00:00
Athenry,5,,N/A,,11,-,W,270, 88 , 0.01 ,1028,Wednesday,05-02-2025,02:00,20250205_100840.json,2025-02-05 02:00:00
Athenry,4,02n,Fair,"""Fair""",7,-,W,270, 89 , 0.0 ,1029,Wednesday,05-02-2025,03:00,20250205_100840.json,2025-02-05 03:00:00
Athenry,2,02n,Fair,"""Fair""",4,-,S,180, 90 , 0.0 ,1030,Wednesday,05-02-2025,04:00,20250205_100840.json,2025-02-05 04:00:00
Athenry,3,04n,Cloudy,"""Cloudy""",7,-,SW,225, 91 , 0.0 ,1031,Wednesday,05-02-2025,05:00,20250205_100840.json,2025-02-05 05:00:00
Athenry,3,02n,Fair,"""Fair""",4,-,SW,225, 91 , 0.0 ,1032,Wednesday,05-02-2025,06:00,20250205_100840.json,2025-02-05 06:00:00
Athenry,3,02n,Fair,"""Fair""",9,-,SW,225, 93 , 0.0 ,1033,Wednesday,05-02-2025,07:00,20250205_100840.json,2025-02-05 07:00:00
Athenry,2,02d,Fair,"""Fair""",6,-,S,180, 96 , 0.0 ,1034,Wednesday,05-02-2025,08:00,20250205_100840.json,2025-02-05 08:00:00
Athenry,3,46d,Light rain ,"""Recent Drizzle """,7,-,S,180, 94 , 0.01 ,1035,Wednesday,05-02-2025,09:00,20250205_100840.json,2025-02-05 09:00:00
Athenry,0,02n,Fair,"""Fair""",2,-,SE,135, 96 , 0.0 ,1043,Thursday,06-02-2025,00:00,20250206_100850.json,2025-02-06 00:00:00
Athenry,-2,02n,Fair,"""Fair""",4,-,E,90, 95 , 0.0 ,1043,Thursday,06-02-2025,01:00,20250206_100850.json,2025-02-06 01:00:00
Athenry,-2,02n,Fair,"""Fair""",4,-,E,90, 96 , 0.0 ,1043,Thursday,06-02-2025,02:00,20250206_100850.json,2025-02-06 02:00:00
Athenry,-2,02n,Fair,"""Fair""",6,-,E,90, 97 , 0.0 ,1042,Thursday,06-02-2025,03:00,20250206_100850.json,2025-02-06 03:00:00
Athenry,-1,02n,Fair,"""Fair""",9,-,E,90, 96 , 0.0 ,1042,Thursday,06-02-2025,04:00,20250206_100850.json,2025-02-06 04:00:00
Athenry,-1,02n,Fair,"""Fair""",9,-,E,90, 93 , 0.0 ,1042,Thursday,06-02-2025,05:00,20250206_100850.json,2025-02-06 05:00:00
Athenry,-1,02n,Fair,"""Fair""",7,-,E,90, 94 , 0.0 ,1042,Thursday,06-02-2025,06:00,20250206_100850.json,2025-02-06 06:00:00
Athenry,-1,02n,Fair,"""Fair""",11,-,E,90, 94 , 0.0 ,1042,Thursday,06-02-2025,07:00,20250206_100850.json,2025-02-06 07:00:00
Athenry,-1,02d,Fair,"""Fair""",11,-,E,90, 94 , 0.0 ,1042,Thursday,06-02-2025,08:00,20250206_100850.json,2025-02-06 08:00:00
Athenry,0,02d,Fair,"""Fair""",9,-,E,90, 95 , 0.0 ,1042,Thursday,06-02-2025,09:00,20250206_100850.json,2025-02-06 09:00:00
Athenry,2,02n,Fair,"""Fair""",13,-,E,90, 92 , 0.0 ,1038,Friday,07-02-2025,00:00,20250207_100855.json,2025-02-07 00:00:00
Athenry,1,02n,Fair,"""Fair""",17,-,E,90, 92 , 0.0 ,1037,Friday,07-02-2025,01:00,20250207_100855.json,2025-02-07 01:00:00
Athenry,1,02n,Fair,"""Fair""",13,-,E,90, 94 , 0.0 ,1037,Friday,07-02-2025,02:00,20250207_100855.json,2025-02-07 02:00:00
Athenry,1,02n,Fair,"""Fair""",11,-,E,90, 94 , 0.0 ,1036,Friday,07-02-2025,03:00,20250207_100855.json,2025-02-07 03:00:00
Athenry,0,02n,Fair,"""Fair""",9,-,E,90, 96 , 0.0 ,1035,Friday,07-02-2025,04:00,20250207_100855.json,2025-02-07 04:00:00
Athenry,1,02n,Fair,"""Fair""",15,-,E,90, 93 , 0.0 ,1035,Friday,07-02-2025,05:00,20250207_100855.json,2025-02-07 05:00:00
Athenry,0,02n,Fair,"""Fair""",17,-,E,90, 92 , 0.0 ,1035,Friday,07-02-2025,06:00,20250207_100855.json,2025-02-07 06:00:00
Athenry,0,02n,Fair,"""Fair""",13,-,E,90, 93 , 0.0 ,1035,Friday,07-02-2025,07:00,20250207_100855.json,2025-02-07 07:00:00
Athenry,-1,02d,Fair,"""Fair""",9,-,NE,45, 95 , 0.0 ,1034,Friday,07-02-2025,08:00,20250207_100855.json,2025-02-07 08:00:00
Athenry,0,15d,Fog / Mist,"""Mist""",9,-,NE,45, 95 , 0.0 ,1034,Friday,07-02-2025,09:00,20250207_100855.json,2025-02-07 09:00:00
Athenry,1,04n,Cloudy,"""Cloudy""",7,-,NE,45, 88 , 0.0 ,1024,Saturday,08-02-2025,00:00,20250208_100714.json,2025-02-08 00:00:00
Athenry,2,04n,Cloudy,"""Cloudy""",9,-,NE,45, 87 , 0.0 ,1023,Saturday,08-02-2025,01:00,20250208_100714.json,2025-02-08 01:00:00
Athenry,1,02n,Fair,"""Fair""",7,-,NE,45, 90 , 0.0 ,1022,Saturday,08-02-2025,02:00,20250208_100714.json,2025-02-08 02:00:00
Athenry,0,04n,Cloudy,"""Cloudy""",6,-,N,0, 93 , 0.0 ,1021,Saturday,08-02-2025,03:00,20250208_100714.json,2025-02-08 03:00:00
Athenry,1,04n,Cloudy,"""Cloudy""",6,-,N,0, 92 , 0.0 ,1021,Saturday,08-02-2025,04:00,20250208_100714.json,2025-02-08 04:00:00
Athenry,0,04n,Cloudy,"""Cloudy""",4,-,NW,315, 92 , 0.0 ,1021,Saturday,08-02-2025,05:00,20250208_100714.json,2025-02-08 05:00:00
Athenry,0,04n,Cloudy,"""Cloudy""",4,-,NE,45, 94 , 0.0 ,1021,Saturday,08-02-2025,06:00,20250208_100714.json,2025-02-08 06:00:00
Athenry,1,04n,Cloudy,"""Cloudy""",7,-,NE,45, 91 , 0.0 ,1021,Saturday,08-02-2025,07:00,20250208_100714.json,2025-02-08 07:00:00
Athenry,1,04d,Cloudy,"""Cloudy""",11,-,NE,45, 88 , 0.0 ,1021,Saturday,08-02-2025,08:00,20250208_100714.json,2025-02-08 08:00:00
Athenry,2,04d,Cloudy,"""Cloudy""",11,-,NE,45, 88 , 0.0 ,1021,Saturday,08-02-2025,09:00,20250208_100714.json,2025-02-08 09:00:00
Athenry,3,04n,Cloudy,"""Cloudy""",11,-,N,0, 74 , 0.0 ,1028,Sunday,09-02-2025,00:00,20250209_100734.json,2025-02-09 00:00:00
Athenry,3,04n,Cloudy,"""Cloudy""",7,-,NE,45, 78 , 0.0 ,1029,Sunday,09-02-2025,01:00,20250209_100734.json,2025-02-09 01:00:00
Athenry,3,04n,Cloudy,"""Cloudy""",13,-,N,0, 80 , 0.0 ,1029,Sunday,09-02-2025,02:00,20250209_100734.json,2025-02-09 02:00:00
Athenry,3,04n,Cloudy,"""Cloudy""",11,-,NE,45, 83 , 0.0 ,1029,Sunday,09-02-2025,03:00,20250209_100734.json,2025-02-09 03:00:00
Athenry,3,04n,Cloudy,"""Cloudy""",9,-,NE,45, 85 , 0.0 ,1030,Sunday,09-02-2025,04:00,20250209_100734.json,2025-02-09 04:00:00
Athenry,3,04n,Cloudy,"""Cloudy""",9,-,NE,45, 85 , 0.0 ,1030,Sunday,09-02-2025,05:00,20250209_100734.json,2025-02-09 05:00:00
Athenry,3,04n,Cloudy,"""Cloudy""",7,-,NE,45, 87 , 0.0 ,1030,Sunday,09-02-2025,06:00,20250209_100734.json,2025-02-09 06:00:00
Athenry,2,04n,Cloudy,"""Cloudy""",7,-,NE,45, 89 , 0.0 ,1031,Sunday,09-02-2025,07:00,20250209_100734.json,2025-02-09 07:00:00
Athenry,3,04d,Cloudy,"""Cloudy""",13,-,N,0, 90 , 0.0 ,1032,Sunday,09-02-2025,08:00,20250209_100734.json,2025-02-09 08:00:00
Athenry,3,04d,Cloudy,"""Cloudy""",13,-,N,0, 89 , 0.0 ,1033,Sunday,09-02-2025,09:00,20250209_100734.json,2025-02-09 09:00:00
Athenry,6,04n,Cloudy,"""Cloudy""",17,-,E,90, 85 , 0.0 ,1035,Monday,10-02-2025,00:00,20250210_100924.json,2025-02-10 00:00:00
Athenry,6,04n,Cloudy,"""Cloudy""",13,-,NE,45, 85 , 0.0 ,1035,Monday,10-02-2025,01:00,20250210_100924.json,2025-02-10 01:00:00
Athenry,6,04n,Cloudy,"""Cloudy""",6,-,NE,45, 88 , 0.0 ,1034,Monday,10-02-2025,02:00,20250210_100924.json,2025-02-10 02:00:00
Athenry,6,04n,Cloudy,"""Cloudy""",6,-,NE,45, 88 , 0.0 ,1034,Monday,10-02-2025,03:00,20250210_100924.json,2025-02-10 03:00:00
Athenry,5,04n,Cloudy,"""Cloudy""",9,-,N,0, 88 , 0.0 ,1034,Monday,10-02-2025,04:00,20250210_100924.json,2025-02-10 04:00:00
Athenry,5,15n,Fog / Mist,"""Mist""",9,-,NE,45, 89 , 0.0 ,1033,Monday,10-02-2025,05:00,20250210_100924.json,2025-02-10 05:00:00
Athenry,5,04n,Cloudy,"""Cloudy""",9,-,NE,45, 88 , 0.0 ,1033,Monday,10-02-2025,06:00,20250210_100924.json,2025-02-10 06:00:00
Athenry,4,15n,Fog / Mist,"""Mist""",9,-,NE,45, 89 , 0.0 ,1032,Monday,10-02-2025,07:00,20250210_100924.json,2025-02-10 07:00:00
Athenry,4,15d,Fog / Mist,"""Mist""",13,-,NE,45, 92 , 0.0 ,1032,Monday,10-02-2025,08:00,20250210_100924.json,2025-02-10 08:00:00
Athenry,4,46d,Light rain ,"""Recent Drizzle """,11,-,NE,45, 92 , 0.01 ,1032,Monday,10-02-2025,09:00,20250210_100924.json,2025-02-10 09:00:00
Athenry,3,05n,Rain showers,"""Rain shower""",15,-,NE,45, 92 , 0.1 ,1025,Tuesday,11-02-2025,00:00,20250211_100927.json,2025-02-11 00:00:00
Athenry,3,04n,Cloudy,"""Cloudy""",17,-,E,90, 93 , 0.0 ,1025,Tuesday,11-02-2025,01:00,20250211_100927.json,2025-02-11 01:00:00
Athenry,3,04n,Cloudy,"""Cloudy""",15,-,E,90, 92 , 0.0 ,1024,Tuesday,11-02-2025,02:00,20250211_100927.json,2025-02-11 02:00:00
Athenry,3,04n,Cloudy,"""Cloudy""",11,-,E,90, 92 , 0.1 ,1024,Tuesday,11-02-2025,03:00,20250211_100927.json,2025-02-11 03:00:00
Athenry,4,04n,Cloudy,"""Cloudy""",17,-,E,90, 92 , 0.0 ,1023,Tuesday,11-02-2025,04:00,20250211_100927.json,2025-02-11 04:00:00
Athenry,4,04n,Cloudy,"""Cloudy""",11,-,E,90, 91 , 0.0 ,1023,Tuesday,11-02-2025,05:00,20250211_100927.json,2025-02-11 05:00:00
